CAL_DATE,CAL_ANNEE,CAL_MOIS,CAL_JOUR,CAL_QUARTER,__KEY_DATE,CAL_TRIMESTRE,CAL_TRIMESTRE_NUM,CAL_JOUR_SEMAINE_NUM,CAL_JOUR_SEMAINE,CAL_JOUR_SEMAINE_ABR
01/01/2000,2000,1,1,1,20000101,2000 - T1,T1,7,Samedi,Sa
02/01/2000,2000,1,2,1,20000102,2000 - T1,T1,1,Dimanche,Di
03/01/2000,2000,1,3,1,20000103,2000 - T1,T1,2,Lundi,Lu
04/01/2000,2000,1,4,1,20000104,2000 - T1,T1,3,Mardi,Ma
05/01/2000,2000,1,5,1,20000105,2000 - T1,T1,4,Mercredi,Me
06/01/2000,2000,1,6,1,20000106,2000 - T1,T1,5,Jeudi,Je
07/01/2000,2000,1,7,1,20000107,2000 - T1,T1,6,Vendredi,Ve
08/01/2000,2000,1,8,1,20000108,2000 - T1,T1,7,Samedi,Sa
09/01/2000,2000,1,9,1,20000109,2000 - T1,T1,1,Dimanche,Di
10/01/2000,2000,1,10,1,20000110,2000 - T1,T1,2,Lundi,Lu
11/01/2000,2000,1,11,1,20000111,2000 - T1,T1,3,Mardi,Ma
12/01/2000,2000,1,12,1,20000112,2000 - T1,T1,4,Mercredi,Me
13/01/2000,2000,1,13,1,20000113,2000 - T1,T1,5,Jeudi,Je
14/01/2000,2000,1,14,1,20000114,2000 - T1,T1,6,Vendredi,Ve
15/01/2000,2000,1,15,1,20000115,2000 - T1,T1,7,Samedi,Sa
16/01/2000,2000,1,16,1,20000116,2000 - T1,T1,1,Dimanche,Di
17/01/2000,2000,1,17,1,20000117,2000 - T1,T1,2,Lundi,Lu
18/01/2000,2000,1,18,1,20000118,2000 - T1,T1,3,Mardi,Ma
19/01/2000,2000,1,19,1,20000119,2000 - T1,T1,4,Mercredi,Me
20/01/2000,2000,1,20,1,20000120,2000 - T1,T1,5,Jeudi,Je
21/01/2000,2000,1,21,1,20000121,2000 - T1,T1,6,Vendredi,Ve
22/01/2000,2000,1,22,1,20000122,2000 - T1,T1,7,Samedi,Sa
23/01/2000,2000,1,23,1,20000123,2000 - T1,T1,1,Dimanche,Di
24/01/2000,2000,1,24,1,20000124,2000 - T1,T1,2,Lundi,Lu
25/01/2000,2000,1,25,1,20000125,2000 - T1,T1,3,Mardi,Ma
26/01/2000,2000,1,26,1,20000126,2000 - T1,T1,4,Mercredi,Me
27/01/2000,2000,1,27,1,20000127,2000 - T1,T1,5,Jeudi,Je
28/01/2000,2000,1,28,1,20000128,2000 - T1,T1,6,Vendredi,Ve
29/01/2000,2000,1,29,1,20000129,2000 - T1,T1,7,Samedi,Sa
30/01/2000,2000,1,30,1,20000130,2000 - T1,T1,1,Dimanche,Di
31/01/2000,2000,1,31,1,20000131,2000 - T1,T1,2,Lundi,Lu
01/02/2000,2000,2,1,1,20000201,2000 - T1,T1,3,Mardi,Ma
02/02/2000,2000,2,2,1,20000202,2000 - T1,T1,4,Mercredi,Me
03/02/2000,2000,2,3,1,20000203,2000 - T1,T1,5,Jeudi,Je
04/02/2000,2000,2,4,1,20000204,2000 - T1,T1,6,Vendredi,Ve
05/02/2000,2000,2,5,1,20000205,2000 - T1,T1,7,Samedi,Sa
06/02/2000,2000,2,6,1,20000206,2000 - T1,T1,1,Dimanche,Di
07/02/2000,2000,2,7,1,20000207,2000 - T1,T1,2,Lundi,Lu
08/02/2000,2000,2,8,1,20000208,2000 - T1,T1,3,Mardi,Ma
09/02/2000,2000,2,9,1,20000209,2000 - T1,T1,4,Mercredi,Me
10/02/2000,2000,2,10,1,20000210,2000 - T1,T1,5,Jeudi,Je
11/02/2000,2000,2,11,1,20000211,2000 - T1,T1,6,Vendredi,Ve
12/02/2000,2000,2,12,1,20000212,2000 - T1,T1,7,Samedi,Sa
13/02/2000,2000,2,13,1,20000213,2000 - T1,T1,1,Dimanche,Di
14/02/2000,2000,2,14,1,20000214,2000 - T1,T1,2,Lundi,Lu
15/02/2000,2000,2,15,1,20000215,2000 - T1,T1,3,Mardi,Ma
16/02/2000,2000,2,16,1,20000216,2000 - T1,T1,4,Mercredi,Me
17/02/2000,2000,2,17,1,20000217,2000 - T1,T1,5,Jeudi,Je
18/02/2000,2000,2,18,1,20000218,2000 - T1,T1,6,Vendredi,Ve
19/02/2000,2000,2,19,1,20000219,2000 - T1,T1,7,Samedi,Sa
20/02/2000,2000,2,20,1,20000220,2000 - T1,T1,1,Dimanche,Di
21/02/2000,2000,2,21,1,20000221,2000 - T1,T1,2,Lundi,Lu
22/02/2000,2000,2,22,1,20000222,2000 - T1,T1,3,Mardi,Ma
23/02/2000,2000,2,23,1,20000223,2000 - T1,T1,4,Mercredi,Me
24/02/2000,2000,2,24,1,20000224,2000 - T1,T1,5,Jeudi,Je
25/02/2000,2000,2,25,1,20000225,2000 - T1,T1,6,Vendredi,Ve
26/02/2000,2000,2,26,1,20000226,2000 - T1,T1,7,Samedi,Sa
27/02/2000,2000,2,27,1,20000227,2000 - T1,T1,1,Dimanche,Di
28/02/2000,2000,2,28,1,20000228,2000 - T1,T1,2,Lundi,Lu
29/02/2000,2000,2,29,1,20000229,2000 - T1,T1,3,Mardi,Ma
01/03/2000,2000,3,1,1,20000301,2000 - T1,T1,4,Mercredi,Me
02/03/2000,2000,3,2,1,20000302,2000 - T1,T1,5,Jeudi,Je
03/03/2000,2000,3,3,1,20000303,2000 - T1,T1,6,Vendredi,Ve
04/03/2000,2000,3,4,1,20000304,2000 - T1,T1,7,Samedi,Sa
05/03/2000,2000,3,5,1,20000305,2000 - T1,T1,1,Dimanche,Di
06/03/2000,2000,3,6,1,20000306,2000 - T1,T1,2,Lundi,Lu
07/03/2000,2000,3,7,1,20000307,2000 - T1,T1,3,Mardi,Ma
08/03/2000,2000,3,8,1,20000308,2000 - T1,T1,4,Mercredi,Me
09/03/2000,2000,3,9,1,20000309,2000 - T1,T1,5,Jeudi,Je
10/03/2000,2000,3,10,1,20000310,2000 - T1,T1,6,Vendredi,Ve
11/03/2000,2000,3,11,1,20000311,2000 - T1,T1,7,Samedi,Sa
12/03/2000,2000,3,12,1,20000312,2000 - T1,T1,1,Dimanche,Di
13/03/2000,2000,3,13,1,20000313,2000 - T1,T1,2,Lundi,Lu
14/03/2000,2000,3,14,1,20000314,2000 - T1,T1,3,Mardi,Ma
15/03/2000,2000,3,15,1,20000315,2000 - T1,T1,4,Mercredi,Me
16/03/2000,2000,3,16,1,20000316,2000 - T1,T1,5,Jeudi,Je
17/03/2000,2000,3,17,1,20000317,2000 - T1,T1,6,Vendredi,Ve
18/03/2000,2000,3,18,1,20000318,2000 - T1,T1,7,Samedi,Sa
19/03/2000,2000,3,19,1,20000319,2000 - T1,T1,1,Dimanche,Di
20/03/2000,2000,3,20,1,20000320,2000 - T1,T1,2,Lundi,Lu
21/03/2000,2000,3,21,1,20000321,2000 - T1,T1,3,Mardi,Ma
22/03/2000,2000,3,22,1,20000322,2000 - T1,T1,4,Mercredi,Me
23/03/2000,2000,3,23,1,20000323,2000 - T1,T1,5,Jeudi,Je
24/03/2000,2000,3,24,1,20000324,2000 - T1,T1,6,Vendredi,Ve
25/03/2000,2000,3,25,1,20000325,2000 - T1,T1,7,Samedi,Sa
26/03/2000,2000,3,26,1,20000326,2000 - T1,T1,1,Dimanche,Di
27/03/2000,2000,3,27,1,20000327,2000 - T1,T1,2,Lundi,Lu
28/03/2000,2000,3,28,1,20000328,2000 - T1,T1,3,Mardi,Ma
29/03/2000,2000,3,29,1,20000329,2000 - T1,T1,4,Mercredi,Me
30/03/2000,2000,3,30,1,20000330,2000 - T1,T1,5,Jeudi,Je
31/03/2000,2000,3,31,1,20000331,2000 - T1,T1,6,Vendredi,Ve
01/04/2000,2000,4,1,2,20000401,2000 - T2,T2,7,Samedi,Sa
02/04/2000,2000,4,2,2,20000402,2000 - T2,T2,1,Dimanche,Di
03/04/2000,2000,4,3,2,20000403,2000 - T2,T2,2,Lundi,Lu
04/04/2000,2000,4,4,2,20000404,2000 - T2,T2,3,Mardi,Ma
05/04/2000,2000,4,5,2,20000405,2000 - T2,T2,4,Mercredi,Me
06/04/2000,2000,4,6,2,20000406,2000 - T2,T2,5,Jeudi,Je
07/04/2000,2000,4,7,2,20000407,2000 - T2,T2,6,Vendredi,Ve
08/04/2000,2000,4,8,2,20000408,2000 - T2,T2,7,Samedi,Sa
09/04/2000,2000,4,9,2,20000409,2000 - T2,T2,1,Dimanche,Di
10/04/2000,2000,4,10,2,20000410,2000 - T2,T2,2,Lundi,Lu
11/04/2000,2000,4,11,2,20000411,2000 - T2,T2,3,Mardi,Ma
12/04/2000,2000,4,12,2,20000412,2000 - T2,T2,4,Mercredi,Me
13/04/2000,2000,4,13,2,20000413,2000 - T2,T2,5,Jeudi,Je
14/04/2000,2000,4,14,2,20000414,2000 - T2,T2,6,Vendredi,Ve
15/04/2000,2000,4,15,2,20000415,2000 - T2,T2,7,Samedi,Sa
16/04/2000,2000,4,16,2,20000416,2000 - T2,T2,1,Dimanche,Di
17/04/2000,2000,4,17,2,20000417,2000 - T2,T2,2,Lundi,Lu
18/04/2000,2000,4,18,2,20000418,2000 - T2,T2,3,Mardi,Ma
19/04/2000,2000,4,19,2,20000419,2000 - T2,T2,4,Mercredi,Me
20/04/2000,2000,4,20,2,20000420,2000 - T2,T2,5,Jeudi,Je
21/04/2000,2000,4,21,2,20000421,2000 - T2,T2,6,Vendredi,Ve
22/04/2000,2000,4,22,2,20000422,2000 - T2,T2,7,Samedi,Sa
23/04/2000,2000,4,23,2,20000423,2000 - T2,T2,1,Dimanche,Di
24/04/2000,2000,4,24,2,20000424,2000 - T2,T2,2,Lundi,Lu
25/04/2000,2000,4,25,2,20000425,2000 - T2,T2,3,Mardi,Ma
26/04/2000,2000,4,26,2,20000426,2000 - T2,T2,4,Mercredi,Me
27/04/2000,2000,4,27,2,20000427,2000 - T2,T2,5,Jeudi,Je
28/04/2000,2000,4,28,2,20000428,2000 - T2,T2,6,Vendredi,Ve
29/04/2000,2000,4,29,2,20000429,2000 - T2,T2,7,Samedi,Sa
30/04/2000,2000,4,30,2,20000430,2000 - T2,T2,1,Dimanche,Di
01/05/2000,2000,5,1,2,20000501,2000 - T2,T2,2,Lundi,Lu
02/05/2000,2000,5,2,2,20000502,2000 - T2,T2,3,Mardi,Ma
03/05/2000,2000,5,3,2,20000503,2000 - T2,T2,4,Mercredi,Me
04/05/2000,2000,5,4,2,20000504,2000 - T2,T2,5,Jeudi,Je
05/05/2000,2000,5,5,2,20000505,2000 - T2,T2,6,Vendredi,Ve
06/05/2000,2000,5,6,2,20000506,2000 - T2,T2,7,Samedi,Sa
07/05/2000,2000,5,7,2,20000507,2000 - T2,T2,1,Dimanche,Di
08/05/2000,2000,5,8,2,20000508,2000 - T2,T2,2,Lundi,Lu
09/05/2000,2000,5,9,2,20000509,2000 - T2,T2,3,Mardi,Ma
10/05/2000,2000,5,10,2,20000510,2000 - T2,T2,4,Mercredi,Me
11/05/2000,2000,5,11,2,20000511,2000 - T2,T2,5,Jeudi,Je
12/05/2000,2000,5,12,2,20000512,2000 - T2,T2,6,Vendredi,Ve
13/05/2000,2000,5,13,2,20000513,2000 - T2,T2,7,Samedi,Sa
14/05/2000,2000,5,14,2,20000514,2000 - T2,T2,1,Dimanche,Di
15/05/2000,2000,5,15,2,20000515,2000 - T2,T2,2,Lundi,Lu
16/05/2000,2000,5,16,2,20000516,2000 - T2,T2,3,Mardi,Ma
17/05/2000,2000,5,17,2,20000517,2000 - T2,T2,4,Mercredi,Me
18/05/2000,2000,5,18,2,20000518,2000 - T2,T2,5,Jeudi,Je
19/05/2000,2000,5,19,2,20000519,2000 - T2,T2,6,Vendredi,Ve
20/05/2000,2000,5,20,2,20000520,2000 - T2,T2,7,Samedi,Sa
21/05/2000,2000,5,21,2,20000521,2000 - T2,T2,1,Dimanche,Di
22/05/2000,2000,5,22,2,20000522,2000 - T2,T2,2,Lundi,Lu
23/05/2000,2000,5,23,2,20000523,2000 - T2,T2,3,Mardi,Ma
24/05/2000,2000,5,24,2,20000524,2000 - T2,T2,4,Mercredi,Me
25/05/2000,2000,5,25,2,20000525,2000 - T2,T2,5,Jeudi,Je
26/05/2000,2000,5,26,2,20000526,2000 - T2,T2,6,Vendredi,Ve
27/05/2000,2000,5,27,2,20000527,2000 - T2,T2,7,Samedi,Sa
28/05/2000,2000,5,28,2,20000528,2000 - T2,T2,1,Dimanche,Di
29/05/2000,2000,5,29,2,20000529,2000 - T2,T2,2,Lundi,Lu
30/05/2000,2000,5,30,2,20000530,2000 - T2,T2,3,Mardi,Ma
31/05/2000,2000,5,31,2,20000531,2000 - T2,T2,4,Mercredi,Me
01/06/2000,2000,6,1,2,20000601,2000 - T2,T2,5,Jeudi,Je
02/06/2000,2000,6,2,2,20000602,2000 - T2,T2,6,Vendredi,Ve
03/06/2000,2000,6,3,2,20000603,2000 - T2,T2,7,Samedi,Sa
04/06/2000,2000,6,4,2,20000604,2000 - T2,T2,1,Dimanche,Di
05/06/2000,2000,6,5,2,20000605,2000 - T2,T2,2,Lundi,Lu
06/06/2000,2000,6,6,2,20000606,2000 - T2,T2,3,Mardi,Ma
07/06/2000,2000,6,7,2,20000607,2000 - T2,T2,4,Mercredi,Me
08/06/2000,2000,6,8,2,20000608,2000 - T2,T2,5,Jeudi,Je
09/06/2000,2000,6,9,2,20000609,2000 - T2,T2,6,Vendredi,Ve
10/06/2000,2000,6,10,2,20000610,2000 - T2,T2,7,Samedi,Sa
11/06/2000,2000,6,11,2,20000611,2000 - T2,T2,1,Dimanche,Di
12/06/2000,2000,6,12,2,20000612,2000 - T2,T2,2,Lundi,Lu
13/06/2000,2000,6,13,2,20000613,2000 - T2,T2,3,Mardi,Ma
14/06/2000,2000,6,14,2,20000614,2000 - T2,T2,4,Mercredi,Me
15/06/2000,2000,6,15,2,20000615,2000 - T2,T2,5,Jeudi,Je
16/06/2000,2000,6,16,2,20000616,2000 - T2,T2,6,Vendredi,Ve
17/06/2000,2000,6,17,2,20000617,2000 - T2,T2,7,Samedi,Sa
18/06/2000,2000,6,18,2,20000618,2000 - T2,T2,1,Dimanche,Di
19/06/2000,2000,6,19,2,20000619,2000 - T2,T2,2,Lundi,Lu
20/06/2000,2000,6,20,2,20000620,2000 - T2,T2,3,Mardi,Ma
21/06/2000,2000,6,21,2,20000621,2000 - T2,T2,4,Mercredi,Me
22/06/2000,2000,6,22,2,20000622,2000 - T2,T2,5,Jeudi,Je
23/06/2000,2000,6,23,2,20000623,2000 - T2,T2,6,Vendredi,Ve
24/06/2000,2000,6,24,2,20000624,2000 - T2,T2,7,Samedi,Sa
25/06/2000,2000,6,25,2,20000625,2000 - T2,T2,1,Dimanche,Di
26/06/2000,2000,6,26,2,20000626,2000 - T2,T2,2,Lundi,Lu
27/06/2000,2000,6,27,2,20000627,2000 - T2,T2,3,Mardi,Ma
28/06/2000,2000,6,28,2,20000628,2000 - T2,T2,4,Mercredi,Me
29/06/2000,2000,6,29,2,20000629,2000 - T2,T2,5,Jeudi,Je
30/06/2000,2000,6,30,2,20000630,2000 - T2,T2,6,Vendredi,Ve
01/07/2000,2000,7,1,3,20000701,2000 - T3,T3,7,Samedi,Sa
02/07/2000,2000,7,2,3,20000702,2000 - T3,T3,1,Dimanche,Di
03/07/2000,2000,7,3,3,20000703,2000 - T3,T3,2,Lundi,Lu
04/07/2000,2000,7,4,3,20000704,2000 - T3,T3,3,Mardi,Ma
05/07/2000,2000,7,5,3,20000705,2000 - T3,T3,4,Mercredi,Me
06/07/2000,2000,7,6,3,20000706,2000 - T3,T3,5,Jeudi,Je
07/07/2000,2000,7,7,3,20000707,2000 - T3,T3,6,Vendredi,Ve
08/07/2000,2000,7,8,3,20000708,2000 - T3,T3,7,Samedi,Sa
09/07/2000,2000,7,9,3,20000709,2000 - T3,T3,1,Dimanche,Di
10/07/2000,2000,7,10,3,20000710,2000 - T3,T3,2,Lundi,Lu
11/07/2000,2000,7,11,3,20000711,2000 - T3,T3,3,Mardi,Ma
12/07/2000,2000,7,12,3,20000712,2000 - T3,T3,4,Mercredi,Me
13/07/2000,2000,7,13,3,20000713,2000 - T3,T3,5,Jeudi,Je
14/07/2000,2000,7,14,3,20000714,2000 - T3,T3,6,Vendredi,Ve
15/07/2000,2000,7,15,3,20000715,2000 - T3,T3,7,Samedi,Sa
16/07/2000,2000,7,16,3,20000716,2000 - T3,T3,1,Dimanche,Di
17/07/2000,2000,7,17,3,20000717,2000 - T3,T3,2,Lundi,Lu
18/07/2000,2000,7,18,3,20000718,2000 - T3,T3,3,Mardi,Ma
19/07/2000,2000,7,19,3,20000719,2000 - T3,T3,4,Mercredi,Me
20/07/2000,2000,7,20,3,20000720,2000 - T3,T3,5,Jeudi,Je
21/07/2000,2000,7,21,3,20000721,2000 - T3,T3,6,Vendredi,Ve
22/07/2000,2000,7,22,3,20000722,2000 - T3,T3,7,Samedi,Sa
23/07/2000,2000,7,23,3,20000723,2000 - T3,T3,1,Dimanche,Di
24/07/2000,2000,7,24,3,20000724,2000 - T3,T3,2,Lundi,Lu
25/07/2000,2000,7,25,3,20000725,2000 - T3,T3,3,Mardi,Ma
26/07/2000,2000,7,26,3,20000726,2000 - T3,T3,4,Mercredi,Me
27/07/2000,2000,7,27,3,20000727,2000 - T3,T3,5,Jeudi,Je
28/07/2000,2000,7,28,3,20000728,2000 - T3,T3,6,Vendredi,Ve
29/07/2000,2000,7,29,3,20000729,2000 - T3,T3,7,Samedi,Sa
30/07/2000,2000,7,30,3,20000730,2000 - T3,T3,1,Dimanche,Di
31/07/2000,2000,7,31,3,20000731,2000 - T3,T3,2,Lundi,Lu
01/08/2000,2000,8,1,3,20000801,2000 - T3,T3,3,Mardi,Ma
02/08/2000,2000,8,2,3,20000802,2000 - T3,T3,4,Mercredi,Me
03/08/2000,2000,8,3,3,20000803,2000 - T3,T3,5,Jeudi,Je
04/08/2000,2000,8,4,3,20000804,2000 - T3,T3,6,Vendredi,Ve
05/08/2000,2000,8,5,3,20000805,2000 - T3,T3,7,Samedi,Sa
06/08/2000,2000,8,6,3,20000806,2000 - T3,T3,1,Dimanche,Di
07/08/2000,2000,8,7,3,20000807,2000 - T3,T3,2,Lundi,Lu
08/08/2000,2000,8,8,3,20000808,2000 - T3,T3,3,Mardi,Ma
09/08/2000,2000,8,9,3,20000809,2000 - T3,T3,4,Mercredi,Me
10/08/2000,2000,8,10,3,20000810,2000 - T3,T3,5,Jeudi,Je
11/08/2000,2000,8,11,3,20000811,2000 - T3,T3,6,Vendredi,Ve
12/08/2000,2000,8,12,3,20000812,2000 - T3,T3,7,Samedi,Sa
13/08/2000,2000,8,13,3,20000813,2000 - T3,T3,1,Dimanche,Di
14/08/2000,2000,8,14,3,20000814,2000 - T3,T3,2,Lundi,Lu
15/08/2000,2000,8,15,3,20000815,2000 - T3,T3,3,Mardi,Ma
16/08/2000,2000,8,16,3,20000816,2000 - T3,T3,4,Mercredi,Me
17/08/2000,2000,8,17,3,20000817,2000 - T3,T3,5,Jeudi,Je
18/08/2000,2000,8,18,3,20000818,2000 - T3,T3,6,Vendredi,Ve
19/08/2000,2000,8,19,3,20000819,2000 - T3,T3,7,Samedi,Sa
20/08/2000,2000,8,20,3,20000820,2000 - T3,T3,1,Dimanche,Di
21/08/2000,2000,8,21,3,20000821,2000 - T3,T3,2,Lundi,Lu
22/08/2000,2000,8,22,3,20000822,2000 - T3,T3,3,Mardi,Ma
23/08/2000,2000,8,23,3,20000823,2000 - T3,T3,4,Mercredi,Me
24/08/2000,2000,8,24,3,20000824,2000 - T3,T3,5,Jeudi,Je
25/08/2000,2000,8,25,3,20000825,2000 - T3,T3,6,Vendredi,Ve
26/08/2000,2000,8,26,3,20000826,2000 - T3,T3,7,Samedi,Sa
27/08/2000,2000,8,27,3,20000827,2000 - T3,T3,1,Dimanche,Di
28/08/2000,2000,8,28,3,20000828,2000 - T3,T3,2,Lundi,Lu
29/08/2000,2000,8,29,3,20000829,2000 - T3,T3,3,Mardi,Ma
30/08/2000,2000,8,30,3,20000830,2000 - T3,T3,4,Mercredi,Me
31/08/2000,2000,8,31,3,20000831,2000 - T3,T3,5,Jeudi,Je
01/09/2000,2000,9,1,3,20000901,2000 - T3,T3,6,Vendredi,Ve
02/09/2000,2000,9,2,3,20000902,2000 - T3,T3,7,Samedi,Sa
03/09/2000,2000,9,3,3,20000903,2000 - T3,T3,1,Dimanche,Di
04/09/2000,2000,9,4,3,20000904,2000 - T3,T3,2,Lundi,Lu
05/09/2000,2000,9,5,3,20000905,2000 - T3,T3,3,Mardi,Ma
06/09/2000,2000,9,6,3,20000906,2000 - T3,T3,4,Mercredi,Me
07/09/2000,2000,9,7,3,20000907,2000 - T3,T3,5,Jeudi,Je
08/09/2000,2000,9,8,3,20000908,2000 - T3,T3,6,Vendredi,Ve
09/09/2000,2000,9,9,3,20000909,2000 - T3,T3,7,Samedi,Sa
10/09/2000,2000,9,10,3,20000910,2000 - T3,T3,1,Dimanche,Di
11/09/2000,2000,9,11,3,20000911,2000 - T3,T3,2,Lundi,Lu
12/09/2000,2000,9,12,3,20000912,2000 - T3,T3,3,Mardi,Ma
13/09/2000,2000,9,13,3,20000913,2000 - T3,T3,4,Mercredi,Me
14/09/2000,2000,9,14,3,20000914,2000 - T3,T3,5,Jeudi,Je
15/09/2000,2000,9,15,3,20000915,2000 - T3,T3,6,Vendredi,Ve
16/09/2000,2000,9,16,3,20000916,2000 - T3,T3,7,Samedi,Sa
17/09/2000,2000,9,17,3,20000917,2000 - T3,T3,1,Dimanche,Di
18/09/2000,2000,9,18,3,20000918,2000 - T3,T3,2,Lundi,Lu
19/09/2000,2000,9,19,3,20000919,2000 - T3,T3,3,Mardi,Ma
20/09/2000,2000,9,20,3,20000920,2000 - T3,T3,4,Mercredi,Me
21/09/2000,2000,9,21,3,20000921,2000 - T3,T3,5,Jeudi,Je
22/09/2000,2000,9,22,3,20000922,2000 - T3,T3,6,Vendredi,Ve
23/09/2000,2000,9,23,3,20000923,2000 - T3,T3,7,Samedi,Sa
24/09/2000,2000,9,24,3,20000924,2000 - T3,T3,1,Dimanche,Di
25/09/2000,2000,9,25,3,20000925,2000 - T3,T3,2,Lundi,Lu
26/09/2000,2000,9,26,3,20000926,2000 - T3,T3,3,Mardi,Ma
27/09/2000,2000,9,27,3,20000927,2000 - T3,T3,4,Mercredi,Me
28/09/2000,2000,9,28,3,20000928,2000 - T3,T3,5,Jeudi,Je
29/09/2000,2000,9,29,3,20000929,2000 - T3,T3,6,Vendredi,Ve
30/09/2000,2000,9,30,3,20000930,2000 - T3,T3,7,Samedi,Sa
01/10/2000,2000,10,1,4,20001001,2000 - T4,T4,1,Dimanche,Di
02/10/2000,2000,10,2,4,20001002,2000 - T4,T4,2,Lundi,Lu
03/10/2000,2000,10,3,4,20001003,2000 - T4,T4,3,Mardi,Ma
04/10/2000,2000,10,4,4,20001004,2000 - T4,T4,4,Mercredi,Me
05/10/2000,2000,10,5,4,20001005,2000 - T4,T4,5,Jeudi,Je
06/10/2000,2000,10,6,4,20001006,2000 - T4,T4,6,Vendredi,Ve
07/10/2000,2000,10,7,4,20001007,2000 - T4,T4,7,Samedi,Sa
08/10/2000,2000,10,8,4,20001008,2000 - T4,T4,1,Dimanche,Di
09/10/2000,2000,10,9,4,20001009,2000 - T4,T4,2,Lundi,Lu
10/10/2000,2000,10,10,4,20001010,2000 - T4,T4,3,Mardi,Ma
11/10/2000,2000,10,11,4,20001011,2000 - T4,T4,4,Mercredi,Me
12/10/2000,2000,10,12,4,20001012,2000 - T4,T4,5,Jeudi,Je
13/10/2000,2000,10,13,4,20001013,2000 - T4,T4,6,Vendredi,Ve
14/10/2000,2000,10,14,4,20001014,2000 - T4,T4,7,Samedi,Sa
15/10/2000,2000,10,15,4,20001015,2000 - T4,T4,1,Dimanche,Di
16/10/2000,2000,10,16,4,20001016,2000 - T4,T4,2,Lundi,Lu
17/10/2000,2000,10,17,4,20001017,2000 - T4,T4,3,Mardi,Ma
18/10/2000,2000,10,18,4,20001018,2000 - T4,T4,4,Mercredi,Me
19/10/2000,2000,10,19,4,20001019,2000 - T4,T4,5,Jeudi,Je
20/10/2000,2000,10,20,4,20001020,2000 - T4,T4,6,Vendredi,Ve
21/10/2000,2000,10,21,4,20001021,2000 - T4,T4,7,Samedi,Sa
22/10/2000,2000,10,22,4,20001022,2000 - T4,T4,1,Dimanche,Di
23/10/2000,2000,10,23,4,20001023,2000 - T4,T4,2,Lundi,Lu
24/10/2000,2000,10,24,4,20001024,2000 - T4,T4,3,Mardi,Ma
25/10/2000,2000,10,25,4,20001025,2000 - T4,T4,4,Mercredi,Me
26/10/2000,2000,10,26,4,20001026,2000 - T4,T4,5,Jeudi,Je
27/10/2000,2000,10,27,4,20001027,2000 - T4,T4,6,Vendredi,Ve
28/10/2000,2000,10,28,4,20001028,2000 - T4,T4,7,Samedi,Sa
29/10/2000,2000,10,29,4,20001029,2000 - T4,T4,1,Dimanche,Di
30/10/2000,2000,10,30,4,20001030,2000 - T4,T4,2,Lundi,Lu
31/10/2000,2000,10,31,4,20001031,2000 - T4,T4,3,Mardi,Ma
01/11/2000,2000,11,1,4,20001101,2000 - T4,T4,4,Mercredi,Me
02/11/2000,2000,11,2,4,20001102,2000 - T4,T4,5,Jeudi,Je
03/11/2000,2000,11,3,4,20001103,2000 - T4,T4,6,Vendredi,Ve
04/11/2000,2000,11,4,4,20001104,2000 - T4,T4,7,Samedi,Sa
05/11/2000,2000,11,5,4,20001105,2000 - T4,T4,1,Dimanche,Di
06/11/2000,2000,11,6,4,20001106,2000 - T4,T4,2,Lundi,Lu
07/11/2000,2000,11,7,4,20001107,2000 - T4,T4,3,Mardi,Ma
08/11/2000,2000,11,8,4,20001108,2000 - T4,T4,4,Mercredi,Me
09/11/2000,2000,11,9,4,20001109,2000 - T4,T4,5,Jeudi,Je
10/11/2000,2000,11,10,4,20001110,2000 - T4,T4,6,Vendredi,Ve
11/11/2000,2000,11,11,4,20001111,2000 - T4,T4,7,Samedi,Sa
12/11/2000,2000,11,12,4,20001112,2000 - T4,T4,1,Dimanche,Di
13/11/2000,2000,11,13,4,20001113,2000 - T4,T4,2,Lundi,Lu
14/11/2000,2000,11,14,4,20001114,2000 - T4,T4,3,Mardi,Ma
15/11/2000,2000,11,15,4,20001115,2000 - T4,T4,4,Mercredi,Me
16/11/2000,2000,11,16,4,20001116,2000 - T4,T4,5,Jeudi,Je
17/11/2000,2000,11,17,4,20001117,2000 - T4,T4,6,Vendredi,Ve
18/11/2000,2000,11,18,4,20001118,2000 - T4,T4,7,Samedi,Sa
19/11/2000,2000,11,19,4,20001119,2000 - T4,T4,1,Dimanche,Di
20/11/2000,2000,11,20,4,20001120,2000 - T4,T4,2,Lundi,Lu
21/11/2000,2000,11,21,4,20001121,2000 - T4,T4,3,Mardi,Ma
22/11/2000,2000,11,22,4,20001122,2000 - T4,T4,4,Mercredi,Me
23/11/2000,2000,11,23,4,20001123,2000 - T4,T4,5,Jeudi,Je
24/11/2000,2000,11,24,4,20001124,2000 - T4,T4,6,Vendredi,Ve
25/11/2000,2000,11,25,4,20001125,2000 - T4,T4,7,Samedi,Sa
26/11/2000,2000,11,26,4,20001126,2000 - T4,T4,1,Dimanche,Di
27/11/2000,2000,11,27,4,20001127,2000 - T4,T4,2,Lundi,Lu
28/11/2000,2000,11,28,4,20001128,2000 - T4,T4,3,Mardi,Ma
29/11/2000,2000,11,29,4,20001129,2000 - T4,T4,4,Mercredi,Me
30/11/2000,2000,11,30,4,20001130,2000 - T4,T4,5,Jeudi,Je
01/12/2000,2000,12,1,4,20001201,2000 - T4,T4,6,Vendredi,Ve
02/12/2000,2000,12,2,4,20001202,2000 - T4,T4,7,Samedi,Sa
03/12/2000,2000,12,3,4,20001203,2000 - T4,T4,1,Dimanche,Di
04/12/2000,2000,12,4,4,20001204,2000 - T4,T4,2,Lundi,Lu
05/12/2000,2000,12,5,4,20001205,2000 - T4,T4,3,Mardi,Ma
06/12/2000,2000,12,6,4,20001206,2000 - T4,T4,4,Mercredi,Me
07/12/2000,2000,12,7,4,20001207,2000 - T4,T4,5,Jeudi,Je
08/12/2000,2000,12,8,4,20001208,2000 - T4,T4,6,Vendredi,Ve
09/12/2000,2000,12,9,4,20001209,2000 - T4,T4,7,Samedi,Sa
10/12/2000,2000,12,10,4,20001210,2000 - T4,T4,1,Dimanche,Di
11/12/2000,2000,12,11,4,20001211,2000 - T4,T4,2,Lundi,Lu
12/12/2000,2000,12,12,4,20001212,2000 - T4,T4,3,Mardi,Ma
13/12/2000,2000,12,13,4,20001213,2000 - T4,T4,4,Mercredi,Me
14/12/2000,2000,12,14,4,20001214,2000 - T4,T4,5,Jeudi,Je
15/12/2000,2000,12,15,4,20001215,2000 - T4,T4,6,Vendredi,Ve
16/12/2000,2000,12,16,4,20001216,2000 - T4,T4,7,Samedi,Sa
17/12/2000,2000,12,17,4,20001217,2000 - T4,T4,1,Dimanche,Di
18/12/2000,2000,12,18,4,20001218,2000 - T4,T4,2,Lundi,Lu
19/12/2000,2000,12,19,4,20001219,2000 - T4,T4,3,Mardi,Ma
20/12/2000,2000,12,20,4,20001220,2000 - T4,T4,4,Mercredi,Me
21/12/2000,2000,12,21,4,20001221,2000 - T4,T4,5,Jeudi,Je
22/12/2000,2000,12,22,4,20001222,2000 - T4,T4,6,Vendredi,Ve
23/12/2000,2000,12,23,4,20001223,2000 - T4,T4,7,Samedi,Sa
24/12/2000,2000,12,24,4,20001224,2000 - T4,T4,1,Dimanche,Di
25/12/2000,2000,12,25,4,20001225,2000 - T4,T4,2,Lundi,Lu
26/12/2000,2000,12,26,4,20001226,2000 - T4,T4,3,Mardi,Ma
27/12/2000,2000,12,27,4,20001227,2000 - T4,T4,4,Mercredi,Me
28/12/2000,2000,12,28,4,20001228,2000 - T4,T4,5,Jeudi,Je
29/12/2000,2000,12,29,4,20001229,2000 - T4,T4,6,Vendredi,Ve
30/12/2000,2000,12,30,4,20001230,2000 - T4,T4,7,Samedi,Sa
31/12/2000,2000,12,31,4,20001231,2000 - T4,T4,1,Dimanche,Di
01/01/2001,2001,1,1,1,20010101,2001 - T1,T1,2,Lundi,Lu
02/01/2001,2001,1,2,1,20010102,2001 - T1,T1,3,Mardi,Ma
03/01/2001,2001,1,3,1,20010103,2001 - T1,T1,4,Mercredi,Me
04/01/2001,2001,1,4,1,20010104,2001 - T1,T1,5,Jeudi,Je
05/01/2001,2001,1,5,1,20010105,2001 - T1,T1,6,Vendredi,Ve
06/01/2001,2001,1,6,1,20010106,2001 - T1,T1,7,Samedi,Sa
07/01/2001,2001,1,7,1,20010107,2001 - T1,T1,1,Dimanche,Di
08/01/2001,2001,1,8,1,20010108,2001 - T1,T1,2,Lundi,Lu
09/01/2001,2001,1,9,1,20010109,2001 - T1,T1,3,Mardi,Ma
10/01/2001,2001,1,10,1,20010110,2001 - T1,T1,4,Mercredi,Me
11/01/2001,2001,1,11,1,20010111,2001 - T1,T1,5,Jeudi,Je
12/01/2001,2001,1,12,1,20010112,2001 - T1,T1,6,Vendredi,Ve
13/01/2001,2001,1,13,1,20010113,2001 - T1,T1,7,Samedi,Sa
14/01/2001,2001,1,14,1,20010114,2001 - T1,T1,1,Dimanche,Di
15/01/2001,2001,1,15,1,20010115,2001 - T1,T1,2,Lundi,Lu
16/01/2001,2001,1,16,1,20010116,2001 - T1,T1,3,Mardi,Ma
17/01/2001,2001,1,17,1,20010117,2001 - T1,T1,4,Mercredi,Me
18/01/2001,2001,1,18,1,20010118,2001 - T1,T1,5,Jeudi,Je
19/01/2001,2001,1,19,1,20010119,2001 - T1,T1,6,Vendredi,Ve
20/01/2001,2001,1,20,1,20010120,2001 - T1,T1,7,Samedi,Sa
21/01/2001,2001,1,21,1,20010121,2001 - T1,T1,1,Dimanche,Di
22/01/2001,2001,1,22,1,20010122,2001 - T1,T1,2,Lundi,Lu
23/01/2001,2001,1,23,1,20010123,2001 - T1,T1,3,Mardi,Ma
24/01/2001,2001,1,24,1,20010124,2001 - T1,T1,4,Mercredi,Me
25/01/2001,2001,1,25,1,20010125,2001 - T1,T1,5,Jeudi,Je
26/01/2001,2001,1,26,1,20010126,2001 - T1,T1,6,Vendredi,Ve
27/01/2001,2001,1,27,1,20010127,2001 - T1,T1,7,Samedi,Sa
28/01/2001,2001,1,28,1,20010128,2001 - T1,T1,1,Dimanche,Di
29/01/2001,2001,1,29,1,20010129,2001 - T1,T1,2,Lundi,Lu
30/01/2001,2001,1,30,1,20010130,2001 - T1,T1,3,Mardi,Ma
31/01/2001,2001,1,31,1,20010131,2001 - T1,T1,4,Mercredi,Me
01/02/2001,2001,2,1,1,20010201,2001 - T1,T1,5,Jeudi,Je
02/02/2001,2001,2,2,1,20010202,2001 - T1,T1,6,Vendredi,Ve
03/02/2001,2001,2,3,1,20010203,2001 - T1,T1,7,Samedi,Sa
04/02/2001,2001,2,4,1,20010204,2001 - T1,T1,1,Dimanche,Di
05/02/2001,2001,2,5,1,20010205,2001 - T1,T1,2,Lundi,Lu
06/02/2001,2001,2,6,1,20010206,2001 - T1,T1,3,Mardi,Ma
07/02/2001,2001,2,7,1,20010207,2001 - T1,T1,4,Mercredi,Me
08/02/2001,2001,2,8,1,20010208,2001 - T1,T1,5,Jeudi,Je
09/02/2001,2001,2,9,1,20010209,2001 - T1,T1,6,Vendredi,Ve
10/02/2001,2001,2,10,1,20010210,2001 - T1,T1,7,Samedi,Sa
11/02/2001,2001,2,11,1,20010211,2001 - T1,T1,1,Dimanche,Di
12/02/2001,2001,2,12,1,20010212,2001 - T1,T1,2,Lundi,Lu
13/02/2001,2001,2,13,1,20010213,2001 - T1,T1,3,Mardi,Ma
14/02/2001,2001,2,14,1,20010214,2001 - T1,T1,4,Mercredi,Me
15/02/2001,2001,2,15,1,20010215,2001 - T1,T1,5,Jeudi,Je
16/02/2001,2001,2,16,1,20010216,2001 - T1,T1,6,Vendredi,Ve
17/02/2001,2001,2,17,1,20010217,2001 - T1,T1,7,Samedi,Sa
18/02/2001,2001,2,18,1,20010218,2001 - T1,T1,1,Dimanche,Di
19/02/2001,2001,2,19,1,20010219,2001 - T1,T1,2,Lundi,Lu
20/02/2001,2001,2,20,1,20010220,2001 - T1,T1,3,Mardi,Ma
21/02/2001,2001,2,21,1,20010221,2001 - T1,T1,4,Mercredi,Me
22/02/2001,2001,2,22,1,20010222,2001 - T1,T1,5,Jeudi,Je
23/02/2001,2001,2,23,1,20010223,2001 - T1,T1,6,Vendredi,Ve
24/02/2001,2001,2,24,1,20010224,2001 - T1,T1,7,Samedi,Sa
25/02/2001,2001,2,25,1,20010225,2001 - T1,T1,1,Dimanche,Di
26/02/2001,2001,2,26,1,20010226,2001 - T1,T1,2,Lundi,Lu
27/02/2001,2001,2,27,1,20010227,2001 - T1,T1,3,Mardi,Ma
28/02/2001,2001,2,28,1,20010228,2001 - T1,T1,4,Mercredi,Me
01/03/2001,2001,3,1,1,20010301,2001 - T1,T1,5,Jeudi,Je
02/03/2001,2001,3,2,1,20010302,2001 - T1,T1,6,Vendredi,Ve
03/03/2001,2001,3,3,1,20010303,2001 - T1,T1,7,Samedi,Sa
04/03/2001,2001,3,4,1,20010304,2001 - T1,T1,1,Dimanche,Di
05/03/2001,2001,3,5,1,20010305,2001 - T1,T1,2,Lundi,Lu
06/03/2001,2001,3,6,1,20010306,2001 - T1,T1,3,Mardi,Ma
07/03/2001,2001,3,7,1,20010307,2001 - T1,T1,4,Mercredi,Me
08/03/2001,2001,3,8,1,20010308,2001 - T1,T1,5,Jeudi,Je
09/03/2001,2001,3,9,1,20010309,2001 - T1,T1,6,Vendredi,Ve
10/03/2001,2001,3,10,1,20010310,2001 - T1,T1,7,Samedi,Sa
11/03/2001,2001,3,11,1,20010311,2001 - T1,T1,1,Dimanche,Di
12/03/2001,2001,3,12,1,20010312,2001 - T1,T1,2,Lundi,Lu
13/03/2001,2001,3,13,1,20010313,2001 - T1,T1,3,Mardi,Ma
14/03/2001,2001,3,14,1,20010314,2001 - T1,T1,4,Mercredi,Me
15/03/2001,2001,3,15,1,20010315,2001 - T1,T1,5,Jeudi,Je
16/03/2001,2001,3,16,1,20010316,2001 - T1,T1,6,Vendredi,Ve
17/03/2001,2001,3,17,1,20010317,2001 - T1,T1,7,Samedi,Sa
18/03/2001,2001,3,18,1,20010318,2001 - T1,T1,1,Dimanche,Di
19/03/2001,2001,3,19,1,20010319,2001 - T1,T1,2,Lundi,Lu
20/03/2001,2001,3,20,1,20010320,2001 - T1,T1,3,Mardi,Ma
21/03/2001,2001,3,21,1,20010321,2001 - T1,T1,4,Mercredi,Me
22/03/2001,2001,3,22,1,20010322,2001 - T1,T1,5,Jeudi,Je
23/03/2001,2001,3,23,1,20010323,2001 - T1,T1,6,Vendredi,Ve
24/03/2001,2001,3,24,1,20010324,2001 - T1,T1,7,Samedi,Sa
25/03/2001,2001,3,25,1,20010325,2001 - T1,T1,1,Dimanche,Di
26/03/2001,2001,3,26,1,20010326,2001 - T1,T1,2,Lundi,Lu
27/03/2001,2001,3,27,1,20010327,2001 - T1,T1,3,Mardi,Ma
28/03/2001,2001,3,28,1,20010328,2001 - T1,T1,4,Mercredi,Me
29/03/2001,2001,3,29,1,20010329,2001 - T1,T1,5,Jeudi,Je
30/03/2001,2001,3,30,1,20010330,2001 - T1,T1,6,Vendredi,Ve
31/03/2001,2001,3,31,1,20010331,2001 - T1,T1,7,Samedi,Sa
01/04/2001,2001,4,1,2,20010401,2001 - T2,T2,1,Dimanche,Di
02/04/2001,2001,4,2,2,20010402,2001 - T2,T2,2,Lundi,Lu
03/04/2001,2001,4,3,2,20010403,2001 - T2,T2,3,Mardi,Ma
04/04/2001,2001,4,4,2,20010404,2001 - T2,T2,4,Mercredi,Me
05/04/2001,2001,4,5,2,20010405,2001 - T2,T2,5,Jeudi,Je
06/04/2001,2001,4,6,2,20010406,2001 - T2,T2,6,Vendredi,Ve
07/04/2001,2001,4,7,2,20010407,2001 - T2,T2,7,Samedi,Sa
08/04/2001,2001,4,8,2,20010408,2001 - T2,T2,1,Dimanche,Di
09/04/2001,2001,4,9,2,20010409,2001 - T2,T2,2,Lundi,Lu
10/04/2001,2001,4,10,2,20010410,2001 - T2,T2,3,Mardi,Ma
11/04/2001,2001,4,11,2,20010411,2001 - T2,T2,4,Mercredi,Me
12/04/2001,2001,4,12,2,20010412,2001 - T2,T2,5,Jeudi,Je
13/04/2001,2001,4,13,2,20010413,2001 - T2,T2,6,Vendredi,Ve
14/04/2001,2001,4,14,2,20010414,2001 - T2,T2,7,Samedi,Sa
15/04/2001,2001,4,15,2,20010415,2001 - T2,T2,1,Dimanche,Di
16/04/2001,2001,4,16,2,20010416,2001 - T2,T2,2,Lundi,Lu
17/04/2001,2001,4,17,2,20010417,2001 - T2,T2,3,Mardi,Ma
18/04/2001,2001,4,18,2,20010418,2001 - T2,T2,4,Mercredi,Me
19/04/2001,2001,4,19,2,20010419,2001 - T2,T2,5,Jeudi,Je
20/04/2001,2001,4,20,2,20010420,2001 - T2,T2,6,Vendredi,Ve
21/04/2001,2001,4,21,2,20010421,2001 - T2,T2,7,Samedi,Sa
22/04/2001,2001,4,22,2,20010422,2001 - T2,T2,1,Dimanche,Di
23/04/2001,2001,4,23,2,20010423,2001 - T2,T2,2,Lundi,Lu
24/04/2001,2001,4,24,2,20010424,2001 - T2,T2,3,Mardi,Ma
25/04/2001,2001,4,25,2,20010425,2001 - T2,T2,4,Mercredi,Me
26/04/2001,2001,4,26,2,20010426,2001 - T2,T2,5,Jeudi,Je
27/04/2001,2001,4,27,2,20010427,2001 - T2,T2,6,Vendredi,Ve
28/04/2001,2001,4,28,2,20010428,2001 - T2,T2,7,Samedi,Sa
29/04/2001,2001,4,29,2,20010429,2001 - T2,T2,1,Dimanche,Di
30/04/2001,2001,4,30,2,20010430,2001 - T2,T2,2,Lundi,Lu
01/05/2001,2001,5,1,2,20010501,2001 - T2,T2,3,Mardi,Ma
02/05/2001,2001,5,2,2,20010502,2001 - T2,T2,4,Mercredi,Me
03/05/2001,2001,5,3,2,20010503,2001 - T2,T2,5,Jeudi,Je
04/05/2001,2001,5,4,2,20010504,2001 - T2,T2,6,Vendredi,Ve
05/05/2001,2001,5,5,2,20010505,2001 - T2,T2,7,Samedi,Sa
06/05/2001,2001,5,6,2,20010506,2001 - T2,T2,1,Dimanche,Di
07/05/2001,2001,5,7,2,20010507,2001 - T2,T2,2,Lundi,Lu
08/05/2001,2001,5,8,2,20010508,2001 - T2,T2,3,Mardi,Ma
09/05/2001,2001,5,9,2,20010509,2001 - T2,T2,4,Mercredi,Me
10/05/2001,2001,5,10,2,20010510,2001 - T2,T2,5,Jeudi,Je
11/05/2001,2001,5,11,2,20010511,2001 - T2,T2,6,Vendredi,Ve
12/05/2001,2001,5,12,2,20010512,2001 - T2,T2,7,Samedi,Sa
13/05/2001,2001,5,13,2,20010513,2001 - T2,T2,1,Dimanche,Di
14/05/2001,2001,5,14,2,20010514,2001 - T2,T2,2,Lundi,Lu
15/05/2001,2001,5,15,2,20010515,2001 - T2,T2,3,Mardi,Ma
16/05/2001,2001,5,16,2,20010516,2001 - T2,T2,4,Mercredi,Me
17/05/2001,2001,5,17,2,20010517,2001 - T2,T2,5,Jeudi,Je
18/05/2001,2001,5,18,2,20010518,2001 - T2,T2,6,Vendredi,Ve
19/05/2001,2001,5,19,2,20010519,2001 - T2,T2,7,Samedi,Sa
20/05/2001,2001,5,20,2,20010520,2001 - T2,T2,1,Dimanche,Di
21/05/2001,2001,5,21,2,20010521,2001 - T2,T2,2,Lundi,Lu
22/05/2001,2001,5,22,2,20010522,2001 - T2,T2,3,Mardi,Ma
23/05/2001,2001,5,23,2,20010523,2001 - T2,T2,4,Mercredi,Me
24/05/2001,2001,5,24,2,20010524,2001 - T2,T2,5,Jeudi,Je
25/05/2001,2001,5,25,2,20010525,2001 - T2,T2,6,Vendredi,Ve
26/05/2001,2001,5,26,2,20010526,2001 - T2,T2,7,Samedi,Sa
27/05/2001,2001,5,27,2,20010527,2001 - T2,T2,1,Dimanche,Di
28/05/2001,2001,5,28,2,20010528,2001 - T2,T2,2,Lundi,Lu
29/05/2001,2001,5,29,2,20010529,2001 - T2,T2,3,Mardi,Ma
30/05/2001,2001,5,30,2,20010530,2001 - T2,T2,4,Mercredi,Me
31/05/2001,2001,5,31,2,20010531,2001 - T2,T2,5,Jeudi,Je
01/06/2001,2001,6,1,2,20010601,2001 - T2,T2,6,Vendredi,Ve
02/06/2001,2001,6,2,2,20010602,2001 - T2,T2,7,Samedi,Sa
03/06/2001,2001,6,3,2,20010603,2001 - T2,T2,1,Dimanche,Di
04/06/2001,2001,6,4,2,20010604,2001 - T2,T2,2,Lundi,Lu
05/06/2001,2001,6,5,2,20010605,2001 - T2,T2,3,Mardi,Ma
06/06/2001,2001,6,6,2,20010606,2001 - T2,T2,4,Mercredi,Me
07/06/2001,2001,6,7,2,20010607,2001 - T2,T2,5,Jeudi,Je
08/06/2001,2001,6,8,2,20010608,2001 - T2,T2,6,Vendredi,Ve
09/06/2001,2001,6,9,2,20010609,2001 - T2,T2,7,Samedi,Sa
10/06/2001,2001,6,10,2,20010610,2001 - T2,T2,1,Dimanche,Di
11/06/2001,2001,6,11,2,20010611,2001 - T2,T2,2,Lundi,Lu
12/06/2001,2001,6,12,2,20010612,2001 - T2,T2,3,Mardi,Ma
13/06/2001,2001,6,13,2,20010613,2001 - T2,T2,4,Mercredi,Me
14/06/2001,2001,6,14,2,20010614,2001 - T2,T2,5,Jeudi,Je
15/06/2001,2001,6,15,2,20010615,2001 - T2,T2,6,Vendredi,Ve
16/06/2001,2001,6,16,2,20010616,2001 - T2,T2,7,Samedi,Sa
17/06/2001,2001,6,17,2,20010617,2001 - T2,T2,1,Dimanche,Di
18/06/2001,2001,6,18,2,20010618,2001 - T2,T2,2,Lundi,Lu
19/06/2001,2001,6,19,2,20010619,2001 - T2,T2,3,Mardi,Ma
20/06/2001,2001,6,20,2,20010620,2001 - T2,T2,4,Mercredi,Me
21/06/2001,2001,6,21,2,20010621,2001 - T2,T2,5,Jeudi,Je
22/06/2001,2001,6,22,2,20010622,2001 - T2,T2,6,Vendredi,Ve
23/06/2001,2001,6,23,2,20010623,2001 - T2,T2,7,Samedi,Sa
24/06/2001,2001,6,24,2,20010624,2001 - T2,T2,1,Dimanche,Di
25/06/2001,2001,6,25,2,20010625,2001 - T2,T2,2,Lundi,Lu
26/06/2001,2001,6,26,2,20010626,2001 - T2,T2,3,Mardi,Ma
27/06/2001,2001,6,27,2,20010627,2001 - T2,T2,4,Mercredi,Me
28/06/2001,2001,6,28,2,20010628,2001 - T2,T2,5,Jeudi,Je
29/06/2001,2001,6,29,2,20010629,2001 - T2,T2,6,Vendredi,Ve
30/06/2001,2001,6,30,2,20010630,2001 - T2,T2,7,Samedi,Sa
01/07/2001,2001,7,1,3,20010701,2001 - T3,T3,1,Dimanche,Di
02/07/2001,2001,7,2,3,20010702,2001 - T3,T3,2,Lundi,Lu
03/07/2001,2001,7,3,3,20010703,2001 - T3,T3,3,Mardi,Ma
04/07/2001,2001,7,4,3,20010704,2001 - T3,T3,4,Mercredi,Me
05/07/2001,2001,7,5,3,20010705,2001 - T3,T3,5,Jeudi,Je
06/07/2001,2001,7,6,3,20010706,2001 - T3,T3,6,Vendredi,Ve
07/07/2001,2001,7,7,3,20010707,2001 - T3,T3,7,Samedi,Sa
08/07/2001,2001,7,8,3,20010708,2001 - T3,T3,1,Dimanche,Di
09/07/2001,2001,7,9,3,20010709,2001 - T3,T3,2,Lundi,Lu
10/07/2001,2001,7,10,3,20010710,2001 - T3,T3,3,Mardi,Ma
11/07/2001,2001,7,11,3,20010711,2001 - T3,T3,4,Mercredi,Me
12/07/2001,2001,7,12,3,20010712,2001 - T3,T3,5,Jeudi,Je
13/07/2001,2001,7,13,3,20010713,2001 - T3,T3,6,Vendredi,Ve
14/07/2001,2001,7,14,3,20010714,2001 - T3,T3,7,Samedi,Sa
15/07/2001,2001,7,15,3,20010715,2001 - T3,T3,1,Dimanche,Di
16/07/2001,2001,7,16,3,20010716,2001 - T3,T3,2,Lundi,Lu
17/07/2001,2001,7,17,3,20010717,2001 - T3,T3,3,Mardi,Ma
18/07/2001,2001,7,18,3,20010718,2001 - T3,T3,4,Mercredi,Me
19/07/2001,2001,7,19,3,20010719,2001 - T3,T3,5,Jeudi,Je
20/07/2001,2001,7,20,3,20010720,2001 - T3,T3,6,Vendredi,Ve
21/07/2001,2001,7,21,3,20010721,2001 - T3,T3,7,Samedi,Sa
22/07/2001,2001,7,22,3,20010722,2001 - T3,T3,1,Dimanche,Di
23/07/2001,2001,7,23,3,20010723,2001 - T3,T3,2,Lundi,Lu
24/07/2001,2001,7,24,3,20010724,2001 - T3,T3,3,Mardi,Ma
25/07/2001,2001,7,25,3,20010725,2001 - T3,T3,4,Mercredi,Me
26/07/2001,2001,7,26,3,20010726,2001 - T3,T3,5,Jeudi,Je
27/07/2001,2001,7,27,3,20010727,2001 - T3,T3,6,Vendredi,Ve
28/07/2001,2001,7,28,3,20010728,2001 - T3,T3,7,Samedi,Sa
29/07/2001,2001,7,29,3,20010729,2001 - T3,T3,1,Dimanche,Di
30/07/2001,2001,7,30,3,20010730,2001 - T3,T3,2,Lundi,Lu
31/07/2001,2001,7,31,3,20010731,2001 - T3,T3,3,Mardi,Ma
01/08/2001,2001,8,1,3,20010801,2001 - T3,T3,4,Mercredi,Me
02/08/2001,2001,8,2,3,20010802,2001 - T3,T3,5,Jeudi,Je
03/08/2001,2001,8,3,3,20010803,2001 - T3,T3,6,Vendredi,Ve
04/08/2001,2001,8,4,3,20010804,2001 - T3,T3,7,Samedi,Sa
05/08/2001,2001,8,5,3,20010805,2001 - T3,T3,1,Dimanche,Di
06/08/2001,2001,8,6,3,20010806,2001 - T3,T3,2,Lundi,Lu
07/08/2001,2001,8,7,3,20010807,2001 - T3,T3,3,Mardi,Ma
08/08/2001,2001,8,8,3,20010808,2001 - T3,T3,4,Mercredi,Me
09/08/2001,2001,8,9,3,20010809,2001 - T3,T3,5,Jeudi,Je
10/08/2001,2001,8,10,3,20010810,2001 - T3,T3,6,Vendredi,Ve
11/08/2001,2001,8,11,3,20010811,2001 - T3,T3,7,Samedi,Sa
12/08/2001,2001,8,12,3,20010812,2001 - T3,T3,1,Dimanche,Di
13/08/2001,2001,8,13,3,20010813,2001 - T3,T3,2,Lundi,Lu
14/08/2001,2001,8,14,3,20010814,2001 - T3,T3,3,Mardi,Ma
15/08/2001,2001,8,15,3,20010815,2001 - T3,T3,4,Mercredi,Me
16/08/2001,2001,8,16,3,20010816,2001 - T3,T3,5,Jeudi,Je
17/08/2001,2001,8,17,3,20010817,2001 - T3,T3,6,Vendredi,Ve
18/08/2001,2001,8,18,3,20010818,2001 - T3,T3,7,Samedi,Sa
19/08/2001,2001,8,19,3,20010819,2001 - T3,T3,1,Dimanche,Di
20/08/2001,2001,8,20,3,20010820,2001 - T3,T3,2,Lundi,Lu
21/08/2001,2001,8,21,3,20010821,2001 - T3,T3,3,Mardi,Ma
22/08/2001,2001,8,22,3,20010822,2001 - T3,T3,4,Mercredi,Me
23/08/2001,2001,8,23,3,20010823,2001 - T3,T3,5,Jeudi,Je
24/08/2001,2001,8,24,3,20010824,2001 - T3,T3,6,Vendredi,Ve
25/08/2001,2001,8,25,3,20010825,2001 - T3,T3,7,Samedi,Sa
26/08/2001,2001,8,26,3,20010826,2001 - T3,T3,1,Dimanche,Di
27/08/2001,2001,8,27,3,20010827,2001 - T3,T3,2,Lundi,Lu
28/08/2001,2001,8,28,3,20010828,2001 - T3,T3,3,Mardi,Ma
29/08/2001,2001,8,29,3,20010829,2001 - T3,T3,4,Mercredi,Me
30/08/2001,2001,8,30,3,20010830,2001 - T3,T3,5,Jeudi,Je
31/08/2001,2001,8,31,3,20010831,2001 - T3,T3,6,Vendredi,Ve
01/09/2001,2001,9,1,3,20010901,2001 - T3,T3,7,Samedi,Sa
02/09/2001,2001,9,2,3,20010902,2001 - T3,T3,1,Dimanche,Di
03/09/2001,2001,9,3,3,20010903,2001 - T3,T3,2,Lundi,Lu
04/09/2001,2001,9,4,3,20010904,2001 - T3,T3,3,Mardi,Ma
05/09/2001,2001,9,5,3,20010905,2001 - T3,T3,4,Mercredi,Me
06/09/2001,2001,9,6,3,20010906,2001 - T3,T3,5,Jeudi,Je
07/09/2001,2001,9,7,3,20010907,2001 - T3,T3,6,Vendredi,Ve
08/09/2001,2001,9,8,3,20010908,2001 - T3,T3,7,Samedi,Sa
09/09/2001,2001,9,9,3,20010909,2001 - T3,T3,1,Dimanche,Di
10/09/2001,2001,9,10,3,20010910,2001 - T3,T3,2,Lundi,Lu
11/09/2001,2001,9,11,3,20010911,2001 - T3,T3,3,Mardi,Ma
12/09/2001,2001,9,12,3,20010912,2001 - T3,T3,4,Mercredi,Me
13/09/2001,2001,9,13,3,20010913,2001 - T3,T3,5,Jeudi,Je
14/09/2001,2001,9,14,3,20010914,2001 - T3,T3,6,Vendredi,Ve
15/09/2001,2001,9,15,3,20010915,2001 - T3,T3,7,Samedi,Sa
16/09/2001,2001,9,16,3,20010916,2001 - T3,T3,1,Dimanche,Di
17/09/2001,2001,9,17,3,20010917,2001 - T3,T3,2,Lundi,Lu
18/09/2001,2001,9,18,3,20010918,2001 - T3,T3,3,Mardi,Ma
19/09/2001,2001,9,19,3,20010919,2001 - T3,T3,4,Mercredi,Me
20/09/2001,2001,9,20,3,20010920,2001 - T3,T3,5,Jeudi,Je
21/09/2001,2001,9,21,3,20010921,2001 - T3,T3,6,Vendredi,Ve
22/09/2001,2001,9,22,3,20010922,2001 - T3,T3,7,Samedi,Sa
23/09/2001,2001,9,23,3,20010923,2001 - T3,T3,1,Dimanche,Di
24/09/2001,2001,9,24,3,20010924,2001 - T3,T3,2,Lundi,Lu
25/09/2001,2001,9,25,3,20010925,2001 - T3,T3,3,Mardi,Ma
26/09/2001,2001,9,26,3,20010926,2001 - T3,T3,4,Mercredi,Me
27/09/2001,2001,9,27,3,20010927,2001 - T3,T3,5,Jeudi,Je
28/09/2001,2001,9,28,3,20010928,2001 - T3,T3,6,Vendredi,Ve
29/09/2001,2001,9,29,3,20010929,2001 - T3,T3,7,Samedi,Sa
30/09/2001,2001,9,30,3,20010930,2001 - T3,T3,1,Dimanche,Di
01/10/2001,2001,10,1,4,20011001,2001 - T4,T4,2,Lundi,Lu
02/10/2001,2001,10,2,4,20011002,2001 - T4,T4,3,Mardi,Ma
03/10/2001,2001,10,3,4,20011003,2001 - T4,T4,4,Mercredi,Me
04/10/2001,2001,10,4,4,20011004,2001 - T4,T4,5,Jeudi,Je
05/10/2001,2001,10,5,4,20011005,2001 - T4,T4,6,Vendredi,Ve
06/10/2001,2001,10,6,4,20011006,2001 - T4,T4,7,Samedi,Sa
07/10/2001,2001,10,7,4,20011007,2001 - T4,T4,1,Dimanche,Di
08/10/2001,2001,10,8,4,20011008,2001 - T4,T4,2,Lundi,Lu
09/10/2001,2001,10,9,4,20011009,2001 - T4,T4,3,Mardi,Ma
10/10/2001,2001,10,10,4,20011010,2001 - T4,T4,4,Mercredi,Me
11/10/2001,2001,10,11,4,20011011,2001 - T4,T4,5,Jeudi,Je
12/10/2001,2001,10,12,4,20011012,2001 - T4,T4,6,Vendredi,Ve
13/10/2001,2001,10,13,4,20011013,2001 - T4,T4,7,Samedi,Sa
14/10/2001,2001,10,14,4,20011014,2001 - T4,T4,1,Dimanche,Di
15/10/2001,2001,10,15,4,20011015,2001 - T4,T4,2,Lundi,Lu
16/10/2001,2001,10,16,4,20011016,2001 - T4,T4,3,Mardi,Ma
17/10/2001,2001,10,17,4,20011017,2001 - T4,T4,4,Mercredi,Me
18/10/2001,2001,10,18,4,20011018,2001 - T4,T4,5,Jeudi,Je
19/10/2001,2001,10,19,4,20011019,2001 - T4,T4,6,Vendredi,Ve
20/10/2001,2001,10,20,4,20011020,2001 - T4,T4,7,Samedi,Sa
21/10/2001,2001,10,21,4,20011021,2001 - T4,T4,1,Dimanche,Di
22/10/2001,2001,10,22,4,20011022,2001 - T4,T4,2,Lundi,Lu
23/10/2001,2001,10,23,4,20011023,2001 - T4,T4,3,Mardi,Ma
24/10/2001,2001,10,24,4,20011024,2001 - T4,T4,4,Mercredi,Me
25/10/2001,2001,10,25,4,20011025,2001 - T4,T4,5,Jeudi,Je
26/10/2001,2001,10,26,4,20011026,2001 - T4,T4,6,Vendredi,Ve
27/10/2001,2001,10,27,4,20011027,2001 - T4,T4,7,Samedi,Sa
28/10/2001,2001,10,28,4,20011028,2001 - T4,T4,1,Dimanche,Di
29/10/2001,2001,10,29,4,20011029,2001 - T4,T4,2,Lundi,Lu
30/10/2001,2001,10,30,4,20011030,2001 - T4,T4,3,Mardi,Ma
31/10/2001,2001,10,31,4,20011031,2001 - T4,T4,4,Mercredi,Me
01/11/2001,2001,11,1,4,20011101,2001 - T4,T4,5,Jeudi,Je
02/11/2001,2001,11,2,4,20011102,2001 - T4,T4,6,Vendredi,Ve
03/11/2001,2001,11,3,4,20011103,2001 - T4,T4,7,Samedi,Sa
04/11/2001,2001,11,4,4,20011104,2001 - T4,T4,1,Dimanche,Di
05/11/2001,2001,11,5,4,20011105,2001 - T4,T4,2,Lundi,Lu
06/11/2001,2001,11,6,4,20011106,2001 - T4,T4,3,Mardi,Ma
07/11/2001,2001,11,7,4,20011107,2001 - T4,T4,4,Mercredi,Me
08/11/2001,2001,11,8,4,20011108,2001 - T4,T4,5,Jeudi,Je
09/11/2001,2001,11,9,4,20011109,2001 - T4,T4,6,Vendredi,Ve
10/11/2001,2001,11,10,4,20011110,2001 - T4,T4,7,Samedi,Sa
11/11/2001,2001,11,11,4,20011111,2001 - T4,T4,1,Dimanche,Di
12/11/2001,2001,11,12,4,20011112,2001 - T4,T4,2,Lundi,Lu
13/11/2001,2001,11,13,4,20011113,2001 - T4,T4,3,Mardi,Ma
14/11/2001,2001,11,14,4,20011114,2001 - T4,T4,4,Mercredi,Me
15/11/2001,2001,11,15,4,20011115,2001 - T4,T4,5,Jeudi,Je
16/11/2001,2001,11,16,4,20011116,2001 - T4,T4,6,Vendredi,Ve
17/11/2001,2001,11,17,4,20011117,2001 - T4,T4,7,Samedi,Sa
18/11/2001,2001,11,18,4,20011118,2001 - T4,T4,1,Dimanche,Di
19/11/2001,2001,11,19,4,20011119,2001 - T4,T4,2,Lundi,Lu
20/11/2001,2001,11,20,4,20011120,2001 - T4,T4,3,Mardi,Ma
21/11/2001,2001,11,21,4,20011121,2001 - T4,T4,4,Mercredi,Me
22/11/2001,2001,11,22,4,20011122,2001 - T4,T4,5,Jeudi,Je
23/11/2001,2001,11,23,4,20011123,2001 - T4,T4,6,Vendredi,Ve
24/11/2001,2001,11,24,4,20011124,2001 - T4,T4,7,Samedi,Sa
25/11/2001,2001,11,25,4,20011125,2001 - T4,T4,1,Dimanche,Di
26/11/2001,2001,11,26,4,20011126,2001 - T4,T4,2,Lundi,Lu
27/11/2001,2001,11,27,4,20011127,2001 - T4,T4,3,Mardi,Ma
28/11/2001,2001,11,28,4,20011128,2001 - T4,T4,4,Mercredi,Me
29/11/2001,2001,11,29,4,20011129,2001 - T4,T4,5,Jeudi,Je
30/11/2001,2001,11,30,4,20011130,2001 - T4,T4,6,Vendredi,Ve
01/12/2001,2001,12,1,4,20011201,2001 - T4,T4,7,Samedi,Sa
02/12/2001,2001,12,2,4,20011202,2001 - T4,T4,1,Dimanche,Di
03/12/2001,2001,12,3,4,20011203,2001 - T4,T4,2,Lundi,Lu
04/12/2001,2001,12,4,4,20011204,2001 - T4,T4,3,Mardi,Ma
05/12/2001,2001,12,5,4,20011205,2001 - T4,T4,4,Mercredi,Me
06/12/2001,2001,12,6,4,20011206,2001 - T4,T4,5,Jeudi,Je
07/12/2001,2001,12,7,4,20011207,2001 - T4,T4,6,Vendredi,Ve
08/12/2001,2001,12,8,4,20011208,2001 - T4,T4,7,Samedi,Sa
09/12/2001,2001,12,9,4,20011209,2001 - T4,T4,1,Dimanche,Di
10/12/2001,2001,12,10,4,20011210,2001 - T4,T4,2,Lundi,Lu
11/12/2001,2001,12,11,4,20011211,2001 - T4,T4,3,Mardi,Ma
12/12/2001,2001,12,12,4,20011212,2001 - T4,T4,4,Mercredi,Me
13/12/2001,2001,12,13,4,20011213,2001 - T4,T4,5,Jeudi,Je
14/12/2001,2001,12,14,4,20011214,2001 - T4,T4,6,Vendredi,Ve
15/12/2001,2001,12,15,4,20011215,2001 - T4,T4,7,Samedi,Sa
16/12/2001,2001,12,16,4,20011216,2001 - T4,T4,1,Dimanche,Di
17/12/2001,2001,12,17,4,20011217,2001 - T4,T4,2,Lundi,Lu
18/12/2001,2001,12,18,4,20011218,2001 - T4,T4,3,Mardi,Ma
19/12/2001,2001,12,19,4,20011219,2001 - T4,T4,4,Mercredi,Me
20/12/2001,2001,12,20,4,20011220,2001 - T4,T4,5,Jeudi,Je
21/12/2001,2001,12,21,4,20011221,2001 - T4,T4,6,Vendredi,Ve
22/12/2001,2001,12,22,4,20011222,2001 - T4,T4,7,Samedi,Sa
23/12/2001,2001,12,23,4,20011223,2001 - T4,T4,1,Dimanche,Di
24/12/2001,2001,12,24,4,20011224,2001 - T4,T4,2,Lundi,Lu
25/12/2001,2001,12,25,4,20011225,2001 - T4,T4,3,Mardi,Ma
26/12/2001,2001,12,26,4,20011226,2001 - T4,T4,4,Mercredi,Me
27/12/2001,2001,12,27,4,20011227,2001 - T4,T4,5,Jeudi,Je
28/12/2001,2001,12,28,4,20011228,2001 - T4,T4,6,Vendredi,Ve
29/12/2001,2001,12,29,4,20011229,2001 - T4,T4,7,Samedi,Sa
30/12/2001,2001,12,30,4,20011230,2001 - T4,T4,1,Dimanche,Di
31/12/2001,2001,12,31,4,20011231,2001 - T4,T4,2,Lundi,Lu
01/01/2002,2002,1,1,1,20020101,2002 - T1,T1,3,Mardi,Ma
02/01/2002,2002,1,2,1,20020102,2002 - T1,T1,4,Mercredi,Me
03/01/2002,2002,1,3,1,20020103,2002 - T1,T1,5,Jeudi,Je
04/01/2002,2002,1,4,1,20020104,2002 - T1,T1,6,Vendredi,Ve
05/01/2002,2002,1,5,1,20020105,2002 - T1,T1,7,Samedi,Sa
06/01/2002,2002,1,6,1,20020106,2002 - T1,T1,1,Dimanche,Di
07/01/2002,2002,1,7,1,20020107,2002 - T1,T1,2,Lundi,Lu
08/01/2002,2002,1,8,1,20020108,2002 - T1,T1,3,Mardi,Ma
09/01/2002,2002,1,9,1,20020109,2002 - T1,T1,4,Mercredi,Me
10/01/2002,2002,1,10,1,20020110,2002 - T1,T1,5,Jeudi,Je
11/01/2002,2002,1,11,1,20020111,2002 - T1,T1,6,Vendredi,Ve
12/01/2002,2002,1,12,1,20020112,2002 - T1,T1,7,Samedi,Sa
13/01/2002,2002,1,13,1,20020113,2002 - T1,T1,1,Dimanche,Di
14/01/2002,2002,1,14,1,20020114,2002 - T1,T1,2,Lundi,Lu
15/01/2002,2002,1,15,1,20020115,2002 - T1,T1,3,Mardi,Ma
16/01/2002,2002,1,16,1,20020116,2002 - T1,T1,4,Mercredi,Me
17/01/2002,2002,1,17,1,20020117,2002 - T1,T1,5,Jeudi,Je
18/01/2002,2002,1,18,1,20020118,2002 - T1,T1,6,Vendredi,Ve
19/01/2002,2002,1,19,1,20020119,2002 - T1,T1,7,Samedi,Sa
20/01/2002,2002,1,20,1,20020120,2002 - T1,T1,1,Dimanche,Di
21/01/2002,2002,1,21,1,20020121,2002 - T1,T1,2,Lundi,Lu
22/01/2002,2002,1,22,1,20020122,2002 - T1,T1,3,Mardi,Ma
23/01/2002,2002,1,23,1,20020123,2002 - T1,T1,4,Mercredi,Me
24/01/2002,2002,1,24,1,20020124,2002 - T1,T1,5,Jeudi,Je
25/01/2002,2002,1,25,1,20020125,2002 - T1,T1,6,Vendredi,Ve
26/01/2002,2002,1,26,1,20020126,2002 - T1,T1,7,Samedi,Sa
27/01/2002,2002,1,27,1,20020127,2002 - T1,T1,1,Dimanche,Di
28/01/2002,2002,1,28,1,20020128,2002 - T1,T1,2,Lundi,Lu
29/01/2002,2002,1,29,1,20020129,2002 - T1,T1,3,Mardi,Ma
30/01/2002,2002,1,30,1,20020130,2002 - T1,T1,4,Mercredi,Me
31/01/2002,2002,1,31,1,20020131,2002 - T1,T1,5,Jeudi,Je
01/02/2002,2002,2,1,1,20020201,2002 - T1,T1,6,Vendredi,Ve
02/02/2002,2002,2,2,1,20020202,2002 - T1,T1,7,Samedi,Sa
03/02/2002,2002,2,3,1,20020203,2002 - T1,T1,1,Dimanche,Di
04/02/2002,2002,2,4,1,20020204,2002 - T1,T1,2,Lundi,Lu
05/02/2002,2002,2,5,1,20020205,2002 - T1,T1,3,Mardi,Ma
06/02/2002,2002,2,6,1,20020206,2002 - T1,T1,4,Mercredi,Me
07/02/2002,2002,2,7,1,20020207,2002 - T1,T1,5,Jeudi,Je
08/02/2002,2002,2,8,1,20020208,2002 - T1,T1,6,Vendredi,Ve
09/02/2002,2002,2,9,1,20020209,2002 - T1,T1,7,Samedi,Sa
10/02/2002,2002,2,10,1,20020210,2002 - T1,T1,1,Dimanche,Di
11/02/2002,2002,2,11,1,20020211,2002 - T1,T1,2,Lundi,Lu
12/02/2002,2002,2,12,1,20020212,2002 - T1,T1,3,Mardi,Ma
13/02/2002,2002,2,13,1,20020213,2002 - T1,T1,4,Mercredi,Me
14/02/2002,2002,2,14,1,20020214,2002 - T1,T1,5,Jeudi,Je
15/02/2002,2002,2,15,1,20020215,2002 - T1,T1,6,Vendredi,Ve
16/02/2002,2002,2,16,1,20020216,2002 - T1,T1,7,Samedi,Sa
17/02/2002,2002,2,17,1,20020217,2002 - T1,T1,1,Dimanche,Di
18/02/2002,2002,2,18,1,20020218,2002 - T1,T1,2,Lundi,Lu
19/02/2002,2002,2,19,1,20020219,2002 - T1,T1,3,Mardi,Ma
20/02/2002,2002,2,20,1,20020220,2002 - T1,T1,4,Mercredi,Me
21/02/2002,2002,2,21,1,20020221,2002 - T1,T1,5,Jeudi,Je
22/02/2002,2002,2,22,1,20020222,2002 - T1,T1,6,Vendredi,Ve
23/02/2002,2002,2,23,1,20020223,2002 - T1,T1,7,Samedi,Sa
24/02/2002,2002,2,24,1,20020224,2002 - T1,T1,1,Dimanche,Di
25/02/2002,2002,2,25,1,20020225,2002 - T1,T1,2,Lundi,Lu
26/02/2002,2002,2,26,1,20020226,2002 - T1,T1,3,Mardi,Ma
27/02/2002,2002,2,27,1,20020227,2002 - T1,T1,4,Mercredi,Me
28/02/2002,2002,2,28,1,20020228,2002 - T1,T1,5,Jeudi,Je
01/03/2002,2002,3,1,1,20020301,2002 - T1,T1,6,Vendredi,Ve
02/03/2002,2002,3,2,1,20020302,2002 - T1,T1,7,Samedi,Sa
03/03/2002,2002,3,3,1,20020303,2002 - T1,T1,1,Dimanche,Di
04/03/2002,2002,3,4,1,20020304,2002 - T1,T1,2,Lundi,Lu
05/03/2002,2002,3,5,1,20020305,2002 - T1,T1,3,Mardi,Ma
06/03/2002,2002,3,6,1,20020306,2002 - T1,T1,4,Mercredi,Me
07/03/2002,2002,3,7,1,20020307,2002 - T1,T1,5,Jeudi,Je
08/03/2002,2002,3,8,1,20020308,2002 - T1,T1,6,Vendredi,Ve
09/03/2002,2002,3,9,1,20020309,2002 - T1,T1,7,Samedi,Sa
10/03/2002,2002,3,10,1,20020310,2002 - T1,T1,1,Dimanche,Di
11/03/2002,2002,3,11,1,20020311,2002 - T1,T1,2,Lundi,Lu
12/03/2002,2002,3,12,1,20020312,2002 - T1,T1,3,Mardi,Ma
13/03/2002,2002,3,13,1,20020313,2002 - T1,T1,4,Mercredi,Me
14/03/2002,2002,3,14,1,20020314,2002 - T1,T1,5,Jeudi,Je
15/03/2002,2002,3,15,1,20020315,2002 - T1,T1,6,Vendredi,Ve
16/03/2002,2002,3,16,1,20020316,2002 - T1,T1,7,Samedi,Sa
17/03/2002,2002,3,17,1,20020317,2002 - T1,T1,1,Dimanche,Di
18/03/2002,2002,3,18,1,20020318,2002 - T1,T1,2,Lundi,Lu
19/03/2002,2002,3,19,1,20020319,2002 - T1,T1,3,Mardi,Ma
20/03/2002,2002,3,20,1,20020320,2002 - T1,T1,4,Mercredi,Me
21/03/2002,2002,3,21,1,20020321,2002 - T1,T1,5,Jeudi,Je
22/03/2002,2002,3,22,1,20020322,2002 - T1,T1,6,Vendredi,Ve
23/03/2002,2002,3,23,1,20020323,2002 - T1,T1,7,Samedi,Sa
24/03/2002,2002,3,24,1,20020324,2002 - T1,T1,1,Dimanche,Di
25/03/2002,2002,3,25,1,20020325,2002 - T1,T1,2,Lundi,Lu
26/03/2002,2002,3,26,1,20020326,2002 - T1,T1,3,Mardi,Ma
27/03/2002,2002,3,27,1,20020327,2002 - T1,T1,4,Mercredi,Me
28/03/2002,2002,3,28,1,20020328,2002 - T1,T1,5,Jeudi,Je
29/03/2002,2002,3,29,1,20020329,2002 - T1,T1,6,Vendredi,Ve
30/03/2002,2002,3,30,1,20020330,2002 - T1,T1,7,Samedi,Sa
31/03/2002,2002,3,31,1,20020331,2002 - T1,T1,1,Dimanche,Di
01/04/2002,2002,4,1,2,20020401,2002 - T2,T2,2,Lundi,Lu
02/04/2002,2002,4,2,2,20020402,2002 - T2,T2,3,Mardi,Ma
03/04/2002,2002,4,3,2,20020403,2002 - T2,T2,4,Mercredi,Me
04/04/2002,2002,4,4,2,20020404,2002 - T2,T2,5,Jeudi,Je
05/04/2002,2002,4,5,2,20020405,2002 - T2,T2,6,Vendredi,Ve
06/04/2002,2002,4,6,2,20020406,2002 - T2,T2,7,Samedi,Sa
07/04/2002,2002,4,7,2,20020407,2002 - T2,T2,1,Dimanche,Di
08/04/2002,2002,4,8,2,20020408,2002 - T2,T2,2,Lundi,Lu
09/04/2002,2002,4,9,2,20020409,2002 - T2,T2,3,Mardi,Ma
10/04/2002,2002,4,10,2,20020410,2002 - T2,T2,4,Mercredi,Me
11/04/2002,2002,4,11,2,20020411,2002 - T2,T2,5,Jeudi,Je
12/04/2002,2002,4,12,2,20020412,2002 - T2,T2,6,Vendredi,Ve
13/04/2002,2002,4,13,2,20020413,2002 - T2,T2,7,Samedi,Sa
14/04/2002,2002,4,14,2,20020414,2002 - T2,T2,1,Dimanche,Di
15/04/2002,2002,4,15,2,20020415,2002 - T2,T2,2,Lundi,Lu
16/04/2002,2002,4,16,2,20020416,2002 - T2,T2,3,Mardi,Ma
17/04/2002,2002,4,17,2,20020417,2002 - T2,T2,4,Mercredi,Me
18/04/2002,2002,4,18,2,20020418,2002 - T2,T2,5,Jeudi,Je
19/04/2002,2002,4,19,2,20020419,2002 - T2,T2,6,Vendredi,Ve
20/04/2002,2002,4,20,2,20020420,2002 - T2,T2,7,Samedi,Sa
21/04/2002,2002,4,21,2,20020421,2002 - T2,T2,1,Dimanche,Di
22/04/2002,2002,4,22,2,20020422,2002 - T2,T2,2,Lundi,Lu
23/04/2002,2002,4,23,2,20020423,2002 - T2,T2,3,Mardi,Ma
24/04/2002,2002,4,24,2,20020424,2002 - T2,T2,4,Mercredi,Me
25/04/2002,2002,4,25,2,20020425,2002 - T2,T2,5,Jeudi,Je
26/04/2002,2002,4,26,2,20020426,2002 - T2,T2,6,Vendredi,Ve
27/04/2002,2002,4,27,2,20020427,2002 - T2,T2,7,Samedi,Sa
28/04/2002,2002,4,28,2,20020428,2002 - T2,T2,1,Dimanche,Di
29/04/2002,2002,4,29,2,20020429,2002 - T2,T2,2,Lundi,Lu
30/04/2002,2002,4,30,2,20020430,2002 - T2,T2,3,Mardi,Ma
01/05/2002,2002,5,1,2,20020501,2002 - T2,T2,4,Mercredi,Me
02/05/2002,2002,5,2,2,20020502,2002 - T2,T2,5,Jeudi,Je
03/05/2002,2002,5,3,2,20020503,2002 - T2,T2,6,Vendredi,Ve
04/05/2002,2002,5,4,2,20020504,2002 - T2,T2,7,Samedi,Sa
05/05/2002,2002,5,5,2,20020505,2002 - T2,T2,1,Dimanche,Di
06/05/2002,2002,5,6,2,20020506,2002 - T2,T2,2,Lundi,Lu
07/05/2002,2002,5,7,2,20020507,2002 - T2,T2,3,Mardi,Ma
08/05/2002,2002,5,8,2,20020508,2002 - T2,T2,4,Mercredi,Me
09/05/2002,2002,5,9,2,20020509,2002 - T2,T2,5,Jeudi,Je
10/05/2002,2002,5,10,2,20020510,2002 - T2,T2,6,Vendredi,Ve
11/05/2002,2002,5,11,2,20020511,2002 - T2,T2,7,Samedi,Sa
12/05/2002,2002,5,12,2,20020512,2002 - T2,T2,1,Dimanche,Di
13/05/2002,2002,5,13,2,20020513,2002 - T2,T2,2,Lundi,Lu
14/05/2002,2002,5,14,2,20020514,2002 - T2,T2,3,Mardi,Ma
15/05/2002,2002,5,15,2,20020515,2002 - T2,T2,4,Mercredi,Me
16/05/2002,2002,5,16,2,20020516,2002 - T2,T2,5,Jeudi,Je
17/05/2002,2002,5,17,2,20020517,2002 - T2,T2,6,Vendredi,Ve
18/05/2002,2002,5,18,2,20020518,2002 - T2,T2,7,Samedi,Sa
19/05/2002,2002,5,19,2,20020519,2002 - T2,T2,1,Dimanche,Di
20/05/2002,2002,5,20,2,20020520,2002 - T2,T2,2,Lundi,Lu
21/05/2002,2002,5,21,2,20020521,2002 - T2,T2,3,Mardi,Ma
22/05/2002,2002,5,22,2,20020522,2002 - T2,T2,4,Mercredi,Me
23/05/2002,2002,5,23,2,20020523,2002 - T2,T2,5,Jeudi,Je
24/05/2002,2002,5,24,2,20020524,2002 - T2,T2,6,Vendredi,Ve
25/05/2002,2002,5,25,2,20020525,2002 - T2,T2,7,Samedi,Sa
26/05/2002,2002,5,26,2,20020526,2002 - T2,T2,1,Dimanche,Di
27/05/2002,2002,5,27,2,20020527,2002 - T2,T2,2,Lundi,Lu
28/05/2002,2002,5,28,2,20020528,2002 - T2,T2,3,Mardi,Ma
29/05/2002,2002,5,29,2,20020529,2002 - T2,T2,4,Mercredi,Me
30/05/2002,2002,5,30,2,20020530,2002 - T2,T2,5,Jeudi,Je
31/05/2002,2002,5,31,2,20020531,2002 - T2,T2,6,Vendredi,Ve
01/06/2002,2002,6,1,2,20020601,2002 - T2,T2,7,Samedi,Sa
02/06/2002,2002,6,2,2,20020602,2002 - T2,T2,1,Dimanche,Di
03/06/2002,2002,6,3,2,20020603,2002 - T2,T2,2,Lundi,Lu
04/06/2002,2002,6,4,2,20020604,2002 - T2,T2,3,Mardi,Ma
05/06/2002,2002,6,5,2,20020605,2002 - T2,T2,4,Mercredi,Me
06/06/2002,2002,6,6,2,20020606,2002 - T2,T2,5,Jeudi,Je
07/06/2002,2002,6,7,2,20020607,2002 - T2,T2,6,Vendredi,Ve
08/06/2002,2002,6,8,2,20020608,2002 - T2,T2,7,Samedi,Sa
09/06/2002,2002,6,9,2,20020609,2002 - T2,T2,1,Dimanche,Di
10/06/2002,2002,6,10,2,20020610,2002 - T2,T2,2,Lundi,Lu
11/06/2002,2002,6,11,2,20020611,2002 - T2,T2,3,Mardi,Ma
12/06/2002,2002,6,12,2,20020612,2002 - T2,T2,4,Mercredi,Me
13/06/2002,2002,6,13,2,20020613,2002 - T2,T2,5,Jeudi,Je
14/06/2002,2002,6,14,2,20020614,2002 - T2,T2,6,Vendredi,Ve
15/06/2002,2002,6,15,2,20020615,2002 - T2,T2,7,Samedi,Sa
16/06/2002,2002,6,16,2,20020616,2002 - T2,T2,1,Dimanche,Di
17/06/2002,2002,6,17,2,20020617,2002 - T2,T2,2,Lundi,Lu
18/06/2002,2002,6,18,2,20020618,2002 - T2,T2,3,Mardi,Ma
19/06/2002,2002,6,19,2,20020619,2002 - T2,T2,4,Mercredi,Me
20/06/2002,2002,6,20,2,20020620,2002 - T2,T2,5,Jeudi,Je
21/06/2002,2002,6,21,2,20020621,2002 - T2,T2,6,Vendredi,Ve
22/06/2002,2002,6,22,2,20020622,2002 - T2,T2,7,Samedi,Sa
23/06/2002,2002,6,23,2,20020623,2002 - T2,T2,1,Dimanche,Di
24/06/2002,2002,6,24,2,20020624,2002 - T2,T2,2,Lundi,Lu
25/06/2002,2002,6,25,2,20020625,2002 - T2,T2,3,Mardi,Ma
26/06/2002,2002,6,26,2,20020626,2002 - T2,T2,4,Mercredi,Me
27/06/2002,2002,6,27,2,20020627,2002 - T2,T2,5,Jeudi,Je
28/06/2002,2002,6,28,2,20020628,2002 - T2,T2,6,Vendredi,Ve
29/06/2002,2002,6,29,2,20020629,2002 - T2,T2,7,Samedi,Sa
30/06/2002,2002,6,30,2,20020630,2002 - T2,T2,1,Dimanche,Di
01/07/2002,2002,7,1,3,20020701,2002 - T3,T3,2,Lundi,Lu
02/07/2002,2002,7,2,3,20020702,2002 - T3,T3,3,Mardi,Ma
03/07/2002,2002,7,3,3,20020703,2002 - T3,T3,4,Mercredi,Me
04/07/2002,2002,7,4,3,20020704,2002 - T3,T3,5,Jeudi,Je
05/07/2002,2002,7,5,3,20020705,2002 - T3,T3,6,Vendredi,Ve
06/07/2002,2002,7,6,3,20020706,2002 - T3,T3,7,Samedi,Sa
07/07/2002,2002,7,7,3,20020707,2002 - T3,T3,1,Dimanche,Di
08/07/2002,2002,7,8,3,20020708,2002 - T3,T3,2,Lundi,Lu
09/07/2002,2002,7,9,3,20020709,2002 - T3,T3,3,Mardi,Ma
10/07/2002,2002,7,10,3,20020710,2002 - T3,T3,4,Mercredi,Me
11/07/2002,2002,7,11,3,20020711,2002 - T3,T3,5,Jeudi,Je
12/07/2002,2002,7,12,3,20020712,2002 - T3,T3,6,Vendredi,Ve
13/07/2002,2002,7,13,3,20020713,2002 - T3,T3,7,Samedi,Sa
14/07/2002,2002,7,14,3,20020714,2002 - T3,T3,1,Dimanche,Di
15/07/2002,2002,7,15,3,20020715,2002 - T3,T3,2,Lundi,Lu
16/07/2002,2002,7,16,3,20020716,2002 - T3,T3,3,Mardi,Ma
17/07/2002,2002,7,17,3,20020717,2002 - T3,T3,4,Mercredi,Me
18/07/2002,2002,7,18,3,20020718,2002 - T3,T3,5,Jeudi,Je
19/07/2002,2002,7,19,3,20020719,2002 - T3,T3,6,Vendredi,Ve
20/07/2002,2002,7,20,3,20020720,2002 - T3,T3,7,Samedi,Sa
21/07/2002,2002,7,21,3,20020721,2002 - T3,T3,1,Dimanche,Di
22/07/2002,2002,7,22,3,20020722,2002 - T3,T3,2,Lundi,Lu
23/07/2002,2002,7,23,3,20020723,2002 - T3,T3,3,Mardi,Ma
24/07/2002,2002,7,24,3,20020724,2002 - T3,T3,4,Mercredi,Me
25/07/2002,2002,7,25,3,20020725,2002 - T3,T3,5,Jeudi,Je
26/07/2002,2002,7,26,3,20020726,2002 - T3,T3,6,Vendredi,Ve
27/07/2002,2002,7,27,3,20020727,2002 - T3,T3,7,Samedi,Sa
28/07/2002,2002,7,28,3,20020728,2002 - T3,T3,1,Dimanche,Di
29/07/2002,2002,7,29,3,20020729,2002 - T3,T3,2,Lundi,Lu
30/07/2002,2002,7,30,3,20020730,2002 - T3,T3,3,Mardi,Ma
31/07/2002,2002,7,31,3,20020731,2002 - T3,T3,4,Mercredi,Me
01/08/2002,2002,8,1,3,20020801,2002 - T3,T3,5,Jeudi,Je
02/08/2002,2002,8,2,3,20020802,2002 - T3,T3,6,Vendredi,Ve
03/08/2002,2002,8,3,3,20020803,2002 - T3,T3,7,Samedi,Sa
04/08/2002,2002,8,4,3,20020804,2002 - T3,T3,1,Dimanche,Di
05/08/2002,2002,8,5,3,20020805,2002 - T3,T3,2,Lundi,Lu
06/08/2002,2002,8,6,3,20020806,2002 - T3,T3,3,Mardi,Ma
07/08/2002,2002,8,7,3,20020807,2002 - T3,T3,4,Mercredi,Me
08/08/2002,2002,8,8,3,20020808,2002 - T3,T3,5,Jeudi,Je
09/08/2002,2002,8,9,3,20020809,2002 - T3,T3,6,Vendredi,Ve
10/08/2002,2002,8,10,3,20020810,2002 - T3,T3,7,Samedi,Sa
11/08/2002,2002,8,11,3,20020811,2002 - T3,T3,1,Dimanche,Di
12/08/2002,2002,8,12,3,20020812,2002 - T3,T3,2,Lundi,Lu
13/08/2002,2002,8,13,3,20020813,2002 - T3,T3,3,Mardi,Ma
14/08/2002,2002,8,14,3,20020814,2002 - T3,T3,4,Mercredi,Me
15/08/2002,2002,8,15,3,20020815,2002 - T3,T3,5,Jeudi,Je
16/08/2002,2002,8,16,3,20020816,2002 - T3,T3,6,Vendredi,Ve
17/08/2002,2002,8,17,3,20020817,2002 - T3,T3,7,Samedi,Sa
18/08/2002,2002,8,18,3,20020818,2002 - T3,T3,1,Dimanche,Di
19/08/2002,2002,8,19,3,20020819,2002 - T3,T3,2,Lundi,Lu
20/08/2002,2002,8,20,3,20020820,2002 - T3,T3,3,Mardi,Ma
21/08/2002,2002,8,21,3,20020821,2002 - T3,T3,4,Mercredi,Me
22/08/2002,2002,8,22,3,20020822,2002 - T3,T3,5,Jeudi,Je
23/08/2002,2002,8,23,3,20020823,2002 - T3,T3,6,Vendredi,Ve
24/08/2002,2002,8,24,3,20020824,2002 - T3,T3,7,Samedi,Sa
25/08/2002,2002,8,25,3,20020825,2002 - T3,T3,1,Dimanche,Di
26/08/2002,2002,8,26,3,20020826,2002 - T3,T3,2,Lundi,Lu
27/08/2002,2002,8,27,3,20020827,2002 - T3,T3,3,Mardi,Ma
28/08/2002,2002,8,28,3,20020828,2002 - T3,T3,4,Mercredi,Me
29/08/2002,2002,8,29,3,20020829,2002 - T3,T3,5,Jeudi,Je
30/08/2002,2002,8,30,3,20020830,2002 - T3,T3,6,Vendredi,Ve
31/08/2002,2002,8,31,3,20020831,2002 - T3,T3,7,Samedi,Sa
01/09/2002,2002,9,1,3,20020901,2002 - T3,T3,1,Dimanche,Di
02/09/2002,2002,9,2,3,20020902,2002 - T3,T3,2,Lundi,Lu
03/09/2002,2002,9,3,3,20020903,2002 - T3,T3,3,Mardi,Ma
04/09/2002,2002,9,4,3,20020904,2002 - T3,T3,4,Mercredi,Me
05/09/2002,2002,9,5,3,20020905,2002 - T3,T3,5,Jeudi,Je
06/09/2002,2002,9,6,3,20020906,2002 - T3,T3,6,Vendredi,Ve
07/09/2002,2002,9,7,3,20020907,2002 - T3,T3,7,Samedi,Sa
08/09/2002,2002,9,8,3,20020908,2002 - T3,T3,1,Dimanche,Di
09/09/2002,2002,9,9,3,20020909,2002 - T3,T3,2,Lundi,Lu
10/09/2002,2002,9,10,3,20020910,2002 - T3,T3,3,Mardi,Ma
11/09/2002,2002,9,11,3,20020911,2002 - T3,T3,4,Mercredi,Me
12/09/2002,2002,9,12,3,20020912,2002 - T3,T3,5,Jeudi,Je
13/09/2002,2002,9,13,3,20020913,2002 - T3,T3,6,Vendredi,Ve
14/09/2002,2002,9,14,3,20020914,2002 - T3,T3,7,Samedi,Sa
15/09/2002,2002,9,15,3,20020915,2002 - T3,T3,1,Dimanche,Di
16/09/2002,2002,9,16,3,20020916,2002 - T3,T3,2,Lundi,Lu
17/09/2002,2002,9,17,3,20020917,2002 - T3,T3,3,Mardi,Ma
18/09/2002,2002,9,18,3,20020918,2002 - T3,T3,4,Mercredi,Me
19/09/2002,2002,9,19,3,20020919,2002 - T3,T3,5,Jeudi,Je
20/09/2002,2002,9,20,3,20020920,2002 - T3,T3,6,Vendredi,Ve
21/09/2002,2002,9,21,3,20020921,2002 - T3,T3,7,Samedi,Sa
22/09/2002,2002,9,22,3,20020922,2002 - T3,T3,1,Dimanche,Di
23/09/2002,2002,9,23,3,20020923,2002 - T3,T3,2,Lundi,Lu
24/09/2002,2002,9,24,3,20020924,2002 - T3,T3,3,Mardi,Ma
25/09/2002,2002,9,25,3,20020925,2002 - T3,T3,4,Mercredi,Me
26/09/2002,2002,9,26,3,20020926,2002 - T3,T3,5,Jeudi,Je
27/09/2002,2002,9,27,3,20020927,2002 - T3,T3,6,Vendredi,Ve
28/09/2002,2002,9,28,3,20020928,2002 - T3,T3,7,Samedi,Sa
29/09/2002,2002,9,29,3,20020929,2002 - T3,T3,1,Dimanche,Di
30/09/2002,2002,9,30,3,20020930,2002 - T3,T3,2,Lundi,Lu
01/10/2002,2002,10,1,4,20021001,2002 - T4,T4,3,Mardi,Ma
02/10/2002,2002,10,2,4,20021002,2002 - T4,T4,4,Mercredi,Me
03/10/2002,2002,10,3,4,20021003,2002 - T4,T4,5,Jeudi,Je
04/10/2002,2002,10,4,4,20021004,2002 - T4,T4,6,Vendredi,Ve
05/10/2002,2002,10,5,4,20021005,2002 - T4,T4,7,Samedi,Sa
06/10/2002,2002,10,6,4,20021006,2002 - T4,T4,1,Dimanche,Di
07/10/2002,2002,10,7,4,20021007,2002 - T4,T4,2,Lundi,Lu
08/10/2002,2002,10,8,4,20021008,2002 - T4,T4,3,Mardi,Ma
09/10/2002,2002,10,9,4,20021009,2002 - T4,T4,4,Mercredi,Me
10/10/2002,2002,10,10,4,20021010,2002 - T4,T4,5,Jeudi,Je
11/10/2002,2002,10,11,4,20021011,2002 - T4,T4,6,Vendredi,Ve
12/10/2002,2002,10,12,4,20021012,2002 - T4,T4,7,Samedi,Sa
13/10/2002,2002,10,13,4,20021013,2002 - T4,T4,1,Dimanche,Di
14/10/2002,2002,10,14,4,20021014,2002 - T4,T4,2,Lundi,Lu
15/10/2002,2002,10,15,4,20021015,2002 - T4,T4,3,Mardi,Ma
16/10/2002,2002,10,16,4,20021016,2002 - T4,T4,4,Mercredi,Me
17/10/2002,2002,10,17,4,20021017,2002 - T4,T4,5,Jeudi,Je
18/10/2002,2002,10,18,4,20021018,2002 - T4,T4,6,Vendredi,Ve
19/10/2002,2002,10,19,4,20021019,2002 - T4,T4,7,Samedi,Sa
20/10/2002,2002,10,20,4,20021020,2002 - T4,T4,1,Dimanche,Di
21/10/2002,2002,10,21,4,20021021,2002 - T4,T4,2,Lundi,Lu
22/10/2002,2002,10,22,4,20021022,2002 - T4,T4,3,Mardi,Ma
23/10/2002,2002,10,23,4,20021023,2002 - T4,T4,4,Mercredi,Me
24/10/2002,2002,10,24,4,20021024,2002 - T4,T4,5,Jeudi,Je
25/10/2002,2002,10,25,4,20021025,2002 - T4,T4,6,Vendredi,Ve
26/10/2002,2002,10,26,4,20021026,2002 - T4,T4,7,Samedi,Sa
27/10/2002,2002,10,27,4,20021027,2002 - T4,T4,1,Dimanche,Di
28/10/2002,2002,10,28,4,20021028,2002 - T4,T4,2,Lundi,Lu
29/10/2002,2002,10,29,4,20021029,2002 - T4,T4,3,Mardi,Ma
30/10/2002,2002,10,30,4,20021030,2002 - T4,T4,4,Mercredi,Me
31/10/2002,2002,10,31,4,20021031,2002 - T4,T4,5,Jeudi,Je
01/11/2002,2002,11,1,4,20021101,2002 - T4,T4,6,Vendredi,Ve
02/11/2002,2002,11,2,4,20021102,2002 - T4,T4,7,Samedi,Sa
03/11/2002,2002,11,3,4,20021103,2002 - T4,T4,1,Dimanche,Di
04/11/2002,2002,11,4,4,20021104,2002 - T4,T4,2,Lundi,Lu
05/11/2002,2002,11,5,4,20021105,2002 - T4,T4,3,Mardi,Ma
06/11/2002,2002,11,6,4,20021106,2002 - T4,T4,4,Mercredi,Me
07/11/2002,2002,11,7,4,20021107,2002 - T4,T4,5,Jeudi,Je
08/11/2002,2002,11,8,4,20021108,2002 - T4,T4,6,Vendredi,Ve
09/11/2002,2002,11,9,4,20021109,2002 - T4,T4,7,Samedi,Sa
10/11/2002,2002,11,10,4,20021110,2002 - T4,T4,1,Dimanche,Di
11/11/2002,2002,11,11,4,20021111,2002 - T4,T4,2,Lundi,Lu
12/11/2002,2002,11,12,4,20021112,2002 - T4,T4,3,Mardi,Ma
13/11/2002,2002,11,13,4,20021113,2002 - T4,T4,4,Mercredi,Me
14/11/2002,2002,11,14,4,20021114,2002 - T4,T4,5,Jeudi,Je
15/11/2002,2002,11,15,4,20021115,2002 - T4,T4,6,Vendredi,Ve
16/11/2002,2002,11,16,4,20021116,2002 - T4,T4,7,Samedi,Sa
17/11/2002,2002,11,17,4,20021117,2002 - T4,T4,1,Dimanche,Di
18/11/2002,2002,11,18,4,20021118,2002 - T4,T4,2,Lundi,Lu
19/11/2002,2002,11,19,4,20021119,2002 - T4,T4,3,Mardi,Ma
20/11/2002,2002,11,20,4,20021120,2002 - T4,T4,4,Mercredi,Me
21/11/2002,2002,11,21,4,20021121,2002 - T4,T4,5,Jeudi,Je
22/11/2002,2002,11,22,4,20021122,2002 - T4,T4,6,Vendredi,Ve
23/11/2002,2002,11,23,4,20021123,2002 - T4,T4,7,Samedi,Sa
24/11/2002,2002,11,24,4,20021124,2002 - T4,T4,1,Dimanche,Di
25/11/2002,2002,11,25,4,20021125,2002 - T4,T4,2,Lundi,Lu
26/11/2002,2002,11,26,4,20021126,2002 - T4,T4,3,Mardi,Ma
27/11/2002,2002,11,27,4,20021127,2002 - T4,T4,4,Mercredi,Me
28/11/2002,2002,11,28,4,20021128,2002 - T4,T4,5,Jeudi,Je
29/11/2002,2002,11,29,4,20021129,2002 - T4,T4,6,Vendredi,Ve
30/11/2002,2002,11,30,4,20021130,2002 - T4,T4,7,Samedi,Sa
01/12/2002,2002,12,1,4,20021201,2002 - T4,T4,1,Dimanche,Di
02/12/2002,2002,12,2,4,20021202,2002 - T4,T4,2,Lundi,Lu
03/12/2002,2002,12,3,4,20021203,2002 - T4,T4,3,Mardi,Ma
04/12/2002,2002,12,4,4,20021204,2002 - T4,T4,4,Mercredi,Me
05/12/2002,2002,12,5,4,20021205,2002 - T4,T4,5,Jeudi,Je
06/12/2002,2002,12,6,4,20021206,2002 - T4,T4,6,Vendredi,Ve
07/12/2002,2002,12,7,4,20021207,2002 - T4,T4,7,Samedi,Sa
08/12/2002,2002,12,8,4,20021208,2002 - T4,T4,1,Dimanche,Di
09/12/2002,2002,12,9,4,20021209,2002 - T4,T4,2,Lundi,Lu
10/12/2002,2002,12,10,4,20021210,2002 - T4,T4,3,Mardi,Ma
11/12/2002,2002,12,11,4,20021211,2002 - T4,T4,4,Mercredi,Me
12/12/2002,2002,12,12,4,20021212,2002 - T4,T4,5,Jeudi,Je
13/12/2002,2002,12,13,4,20021213,2002 - T4,T4,6,Vendredi,Ve
14/12/2002,2002,12,14,4,20021214,2002 - T4,T4,7,Samedi,Sa
15/12/2002,2002,12,15,4,20021215,2002 - T4,T4,1,Dimanche,Di
16/12/2002,2002,12,16,4,20021216,2002 - T4,T4,2,Lundi,Lu
17/12/2002,2002,12,17,4,20021217,2002 - T4,T4,3,Mardi,Ma
18/12/2002,2002,12,18,4,20021218,2002 - T4,T4,4,Mercredi,Me
19/12/2002,2002,12,19,4,20021219,2002 - T4,T4,5,Jeudi,Je
20/12/2002,2002,12,20,4,20021220,2002 - T4,T4,6,Vendredi,Ve
21/12/2002,2002,12,21,4,20021221,2002 - T4,T4,7,Samedi,Sa
22/12/2002,2002,12,22,4,20021222,2002 - T4,T4,1,Dimanche,Di
23/12/2002,2002,12,23,4,20021223,2002 - T4,T4,2,Lundi,Lu
24/12/2002,2002,12,24,4,20021224,2002 - T4,T4,3,Mardi,Ma
25/12/2002,2002,12,25,4,20021225,2002 - T4,T4,4,Mercredi,Me
26/12/2002,2002,12,26,4,20021226,2002 - T4,T4,5,Jeudi,Je
27/12/2002,2002,12,27,4,20021227,2002 - T4,T4,6,Vendredi,Ve
28/12/2002,2002,12,28,4,20021228,2002 - T4,T4,7,Samedi,Sa
29/12/2002,2002,12,29,4,20021229,2002 - T4,T4,1,Dimanche,Di
30/12/2002,2002,12,30,4,20021230,2002 - T4,T4,2,Lundi,Lu
31/12/2002,2002,12,31,4,20021231,2002 - T4,T4,3,Mardi,Ma
01/01/2003,2003,1,1,1,20030101,2003 - T1,T1,4,Mercredi,Me
02/01/2003,2003,1,2,1,20030102,2003 - T1,T1,5,Jeudi,Je
03/01/2003,2003,1,3,1,20030103,2003 - T1,T1,6,Vendredi,Ve
04/01/2003,2003,1,4,1,20030104,2003 - T1,T1,7,Samedi,Sa
05/01/2003,2003,1,5,1,20030105,2003 - T1,T1,1,Dimanche,Di
06/01/2003,2003,1,6,1,20030106,2003 - T1,T1,2,Lundi,Lu
07/01/2003,2003,1,7,1,20030107,2003 - T1,T1,3,Mardi,Ma
08/01/2003,2003,1,8,1,20030108,2003 - T1,T1,4,Mercredi,Me
09/01/2003,2003,1,9,1,20030109,2003 - T1,T1,5,Jeudi,Je
10/01/2003,2003,1,10,1,20030110,2003 - T1,T1,6,Vendredi,Ve
11/01/2003,2003,1,11,1,20030111,2003 - T1,T1,7,Samedi,Sa
12/01/2003,2003,1,12,1,20030112,2003 - T1,T1,1,Dimanche,Di
13/01/2003,2003,1,13,1,20030113,2003 - T1,T1,2,Lundi,Lu
14/01/2003,2003,1,14,1,20030114,2003 - T1,T1,3,Mardi,Ma
15/01/2003,2003,1,15,1,20030115,2003 - T1,T1,4,Mercredi,Me
16/01/2003,2003,1,16,1,20030116,2003 - T1,T1,5,Jeudi,Je
17/01/2003,2003,1,17,1,20030117,2003 - T1,T1,6,Vendredi,Ve
18/01/2003,2003,1,18,1,20030118,2003 - T1,T1,7,Samedi,Sa
19/01/2003,2003,1,19,1,20030119,2003 - T1,T1,1,Dimanche,Di
20/01/2003,2003,1,20,1,20030120,2003 - T1,T1,2,Lundi,Lu
21/01/2003,2003,1,21,1,20030121,2003 - T1,T1,3,Mardi,Ma
22/01/2003,2003,1,22,1,20030122,2003 - T1,T1,4,Mercredi,Me
23/01/2003,2003,1,23,1,20030123,2003 - T1,T1,5,Jeudi,Je
24/01/2003,2003,1,24,1,20030124,2003 - T1,T1,6,Vendredi,Ve
25/01/2003,2003,1,25,1,20030125,2003 - T1,T1,7,Samedi,Sa
26/01/2003,2003,1,26,1,20030126,2003 - T1,T1,1,Dimanche,Di
27/01/2003,2003,1,27,1,20030127,2003 - T1,T1,2,Lundi,Lu
28/01/2003,2003,1,28,1,20030128,2003 - T1,T1,3,Mardi,Ma
29/01/2003,2003,1,29,1,20030129,2003 - T1,T1,4,Mercredi,Me
30/01/2003,2003,1,30,1,20030130,2003 - T1,T1,5,Jeudi,Je
31/01/2003,2003,1,31,1,20030131,2003 - T1,T1,6,Vendredi,Ve
01/02/2003,2003,2,1,1,20030201,2003 - T1,T1,7,Samedi,Sa
02/02/2003,2003,2,2,1,20030202,2003 - T1,T1,1,Dimanche,Di
03/02/2003,2003,2,3,1,20030203,2003 - T1,T1,2,Lundi,Lu
04/02/2003,2003,2,4,1,20030204,2003 - T1,T1,3,Mardi,Ma
05/02/2003,2003,2,5,1,20030205,2003 - T1,T1,4,Mercredi,Me
06/02/2003,2003,2,6,1,20030206,2003 - T1,T1,5,Jeudi,Je
07/02/2003,2003,2,7,1,20030207,2003 - T1,T1,6,Vendredi,Ve
08/02/2003,2003,2,8,1,20030208,2003 - T1,T1,7,Samedi,Sa
09/02/2003,2003,2,9,1,20030209,2003 - T1,T1,1,Dimanche,Di
10/02/2003,2003,2,10,1,20030210,2003 - T1,T1,2,Lundi,Lu
11/02/2003,2003,2,11,1,20030211,2003 - T1,T1,3,Mardi,Ma
12/02/2003,2003,2,12,1,20030212,2003 - T1,T1,4,Mercredi,Me
13/02/2003,2003,2,13,1,20030213,2003 - T1,T1,5,Jeudi,Je
14/02/2003,2003,2,14,1,20030214,2003 - T1,T1,6,Vendredi,Ve
15/02/2003,2003,2,15,1,20030215,2003 - T1,T1,7,Samedi,Sa
16/02/2003,2003,2,16,1,20030216,2003 - T1,T1,1,Dimanche,Di
17/02/2003,2003,2,17,1,20030217,2003 - T1,T1,2,Lundi,Lu
18/02/2003,2003,2,18,1,20030218,2003 - T1,T1,3,Mardi,Ma
19/02/2003,2003,2,19,1,20030219,2003 - T1,T1,4,Mercredi,Me
20/02/2003,2003,2,20,1,20030220,2003 - T1,T1,5,Jeudi,Je
21/02/2003,2003,2,21,1,20030221,2003 - T1,T1,6,Vendredi,Ve
22/02/2003,2003,2,22,1,20030222,2003 - T1,T1,7,Samedi,Sa
23/02/2003,2003,2,23,1,20030223,2003 - T1,T1,1,Dimanche,Di
24/02/2003,2003,2,24,1,20030224,2003 - T1,T1,2,Lundi,Lu
25/02/2003,2003,2,25,1,20030225,2003 - T1,T1,3,Mardi,Ma
26/02/2003,2003,2,26,1,20030226,2003 - T1,T1,4,Mercredi,Me
27/02/2003,2003,2,27,1,20030227,2003 - T1,T1,5,Jeudi,Je
28/02/2003,2003,2,28,1,20030228,2003 - T1,T1,6,Vendredi,Ve
01/03/2003,2003,3,1,1,20030301,2003 - T1,T1,7,Samedi,Sa
02/03/2003,2003,3,2,1,20030302,2003 - T1,T1,1,Dimanche,Di
03/03/2003,2003,3,3,1,20030303,2003 - T1,T1,2,Lundi,Lu
04/03/2003,2003,3,4,1,20030304,2003 - T1,T1,3,Mardi,Ma
05/03/2003,2003,3,5,1,20030305,2003 - T1,T1,4,Mercredi,Me
06/03/2003,2003,3,6,1,20030306,2003 - T1,T1,5,Jeudi,Je
07/03/2003,2003,3,7,1,20030307,2003 - T1,T1,6,Vendredi,Ve
08/03/2003,2003,3,8,1,20030308,2003 - T1,T1,7,Samedi,Sa
09/03/2003,2003,3,9,1,20030309,2003 - T1,T1,1,Dimanche,Di
10/03/2003,2003,3,10,1,20030310,2003 - T1,T1,2,Lundi,Lu
11/03/2003,2003,3,11,1,20030311,2003 - T1,T1,3,Mardi,Ma
12/03/2003,2003,3,12,1,20030312,2003 - T1,T1,4,Mercredi,Me
13/03/2003,2003,3,13,1,20030313,2003 - T1,T1,5,Jeudi,Je
14/03/2003,2003,3,14,1,20030314,2003 - T1,T1,6,Vendredi,Ve
15/03/2003,2003,3,15,1,20030315,2003 - T1,T1,7,Samedi,Sa
16/03/2003,2003,3,16,1,20030316,2003 - T1,T1,1,Dimanche,Di
17/03/2003,2003,3,17,1,20030317,2003 - T1,T1,2,Lundi,Lu
18/03/2003,2003,3,18,1,20030318,2003 - T1,T1,3,Mardi,Ma
19/03/2003,2003,3,19,1,20030319,2003 - T1,T1,4,Mercredi,Me
20/03/2003,2003,3,20,1,20030320,2003 - T1,T1,5,Jeudi,Je
21/03/2003,2003,3,21,1,20030321,2003 - T1,T1,6,Vendredi,Ve
22/03/2003,2003,3,22,1,20030322,2003 - T1,T1,7,Samedi,Sa
23/03/2003,2003,3,23,1,20030323,2003 - T1,T1,1,Dimanche,Di
24/03/2003,2003,3,24,1,20030324,2003 - T1,T1,2,Lundi,Lu
25/03/2003,2003,3,25,1,20030325,2003 - T1,T1,3,Mardi,Ma
26/03/2003,2003,3,26,1,20030326,2003 - T1,T1,4,Mercredi,Me
27/03/2003,2003,3,27,1,20030327,2003 - T1,T1,5,Jeudi,Je
28/03/2003,2003,3,28,1,20030328,2003 - T1,T1,6,Vendredi,Ve
29/03/2003,2003,3,29,1,20030329,2003 - T1,T1,7,Samedi,Sa
30/03/2003,2003,3,30,1,20030330,2003 - T1,T1,1,Dimanche,Di
31/03/2003,2003,3,31,1,20030331,2003 - T1,T1,2,Lundi,Lu
01/04/2003,2003,4,1,2,20030401,2003 - T2,T2,3,Mardi,Ma
02/04/2003,2003,4,2,2,20030402,2003 - T2,T2,4,Mercredi,Me
03/04/2003,2003,4,3,2,20030403,2003 - T2,T2,5,Jeudi,Je
04/04/2003,2003,4,4,2,20030404,2003 - T2,T2,6,Vendredi,Ve
05/04/2003,2003,4,5,2,20030405,2003 - T2,T2,7,Samedi,Sa
06/04/2003,2003,4,6,2,20030406,2003 - T2,T2,1,Dimanche,Di
07/04/2003,2003,4,7,2,20030407,2003 - T2,T2,2,Lundi,Lu
08/04/2003,2003,4,8,2,20030408,2003 - T2,T2,3,Mardi,Ma
09/04/2003,2003,4,9,2,20030409,2003 - T2,T2,4,Mercredi,Me
10/04/2003,2003,4,10,2,20030410,2003 - T2,T2,5,Jeudi,Je
11/04/2003,2003,4,11,2,20030411,2003 - T2,T2,6,Vendredi,Ve
12/04/2003,2003,4,12,2,20030412,2003 - T2,T2,7,Samedi,Sa
13/04/2003,2003,4,13,2,20030413,2003 - T2,T2,1,Dimanche,Di
14/04/2003,2003,4,14,2,20030414,2003 - T2,T2,2,Lundi,Lu
15/04/2003,2003,4,15,2,20030415,2003 - T2,T2,3,Mardi,Ma
16/04/2003,2003,4,16,2,20030416,2003 - T2,T2,4,Mercredi,Me
17/04/2003,2003,4,17,2,20030417,2003 - T2,T2,5,Jeudi,Je
18/04/2003,2003,4,18,2,20030418,2003 - T2,T2,6,Vendredi,Ve
19/04/2003,2003,4,19,2,20030419,2003 - T2,T2,7,Samedi,Sa
20/04/2003,2003,4,20,2,20030420,2003 - T2,T2,1,Dimanche,Di
21/04/2003,2003,4,21,2,20030421,2003 - T2,T2,2,Lundi,Lu
22/04/2003,2003,4,22,2,20030422,2003 - T2,T2,3,Mardi,Ma
23/04/2003,2003,4,23,2,20030423,2003 - T2,T2,4,Mercredi,Me
24/04/2003,2003,4,24,2,20030424,2003 - T2,T2,5,Jeudi,Je
25/04/2003,2003,4,25,2,20030425,2003 - T2,T2,6,Vendredi,Ve
26/04/2003,2003,4,26,2,20030426,2003 - T2,T2,7,Samedi,Sa
27/04/2003,2003,4,27,2,20030427,2003 - T2,T2,1,Dimanche,Di
28/04/2003,2003,4,28,2,20030428,2003 - T2,T2,2,Lundi,Lu
29/04/2003,2003,4,29,2,20030429,2003 - T2,T2,3,Mardi,Ma
30/04/2003,2003,4,30,2,20030430,2003 - T2,T2,4,Mercredi,Me
01/05/2003,2003,5,1,2,20030501,2003 - T2,T2,5,Jeudi,Je
02/05/2003,2003,5,2,2,20030502,2003 - T2,T2,6,Vendredi,Ve
03/05/2003,2003,5,3,2,20030503,2003 - T2,T2,7,Samedi,Sa
04/05/2003,2003,5,4,2,20030504,2003 - T2,T2,1,Dimanche,Di
05/05/2003,2003,5,5,2,20030505,2003 - T2,T2,2,Lundi,Lu
06/05/2003,2003,5,6,2,20030506,2003 - T2,T2,3,Mardi,Ma
07/05/2003,2003,5,7,2,20030507,2003 - T2,T2,4,Mercredi,Me
08/05/2003,2003,5,8,2,20030508,2003 - T2,T2,5,Jeudi,Je
09/05/2003,2003,5,9,2,20030509,2003 - T2,T2,6,Vendredi,Ve
10/05/2003,2003,5,10,2,20030510,2003 - T2,T2,7,Samedi,Sa
11/05/2003,2003,5,11,2,20030511,2003 - T2,T2,1,Dimanche,Di
12/05/2003,2003,5,12,2,20030512,2003 - T2,T2,2,Lundi,Lu
13/05/2003,2003,5,13,2,20030513,2003 - T2,T2,3,Mardi,Ma
14/05/2003,2003,5,14,2,20030514,2003 - T2,T2,4,Mercredi,Me
15/05/2003,2003,5,15,2,20030515,2003 - T2,T2,5,Jeudi,Je
16/05/2003,2003,5,16,2,20030516,2003 - T2,T2,6,Vendredi,Ve
17/05/2003,2003,5,17,2,20030517,2003 - T2,T2,7,Samedi,Sa
18/05/2003,2003,5,18,2,20030518,2003 - T2,T2,1,Dimanche,Di
19/05/2003,2003,5,19,2,20030519,2003 - T2,T2,2,Lundi,Lu
20/05/2003,2003,5,20,2,20030520,2003 - T2,T2,3,Mardi,Ma
21/05/2003,2003,5,21,2,20030521,2003 - T2,T2,4,Mercredi,Me
22/05/2003,2003,5,22,2,20030522,2003 - T2,T2,5,Jeudi,Je
23/05/2003,2003,5,23,2,20030523,2003 - T2,T2,6,Vendredi,Ve
24/05/2003,2003,5,24,2,20030524,2003 - T2,T2,7,Samedi,Sa
25/05/2003,2003,5,25,2,20030525,2003 - T2,T2,1,Dimanche,Di
26/05/2003,2003,5,26,2,20030526,2003 - T2,T2,2,Lundi,Lu
27/05/2003,2003,5,27,2,20030527,2003 - T2,T2,3,Mardi,Ma
28/05/2003,2003,5,28,2,20030528,2003 - T2,T2,4,Mercredi,Me
29/05/2003,2003,5,29,2,20030529,2003 - T2,T2,5,Jeudi,Je
30/05/2003,2003,5,30,2,20030530,2003 - T2,T2,6,Vendredi,Ve
31/05/2003,2003,5,31,2,20030531,2003 - T2,T2,7,Samedi,Sa
01/06/2003,2003,6,1,2,20030601,2003 - T2,T2,1,Dimanche,Di
02/06/2003,2003,6,2,2,20030602,2003 - T2,T2,2,Lundi,Lu
03/06/2003,2003,6,3,2,20030603,2003 - T2,T2,3,Mardi,Ma
04/06/2003,2003,6,4,2,20030604,2003 - T2,T2,4,Mercredi,Me
05/06/2003,2003,6,5,2,20030605,2003 - T2,T2,5,Jeudi,Je
06/06/2003,2003,6,6,2,20030606,2003 - T2,T2,6,Vendredi,Ve
07/06/2003,2003,6,7,2,20030607,2003 - T2,T2,7,Samedi,Sa
08/06/2003,2003,6,8,2,20030608,2003 - T2,T2,1,Dimanche,Di
09/06/2003,2003,6,9,2,20030609,2003 - T2,T2,2,Lundi,Lu
10/06/2003,2003,6,10,2,20030610,2003 - T2,T2,3,Mardi,Ma
11/06/2003,2003,6,11,2,20030611,2003 - T2,T2,4,Mercredi,Me
12/06/2003,2003,6,12,2,20030612,2003 - T2,T2,5,Jeudi,Je
13/06/2003,2003,6,13,2,20030613,2003 - T2,T2,6,Vendredi,Ve
14/06/2003,2003,6,14,2,20030614,2003 - T2,T2,7,Samedi,Sa
15/06/2003,2003,6,15,2,20030615,2003 - T2,T2,1,Dimanche,Di
16/06/2003,2003,6,16,2,20030616,2003 - T2,T2,2,Lundi,Lu
17/06/2003,2003,6,17,2,20030617,2003 - T2,T2,3,Mardi,Ma
18/06/2003,2003,6,18,2,20030618,2003 - T2,T2,4,Mercredi,Me
19/06/2003,2003,6,19,2,20030619,2003 - T2,T2,5,Jeudi,Je
20/06/2003,2003,6,20,2,20030620,2003 - T2,T2,6,Vendredi,Ve
21/06/2003,2003,6,21,2,20030621,2003 - T2,T2,7,Samedi,Sa
22/06/2003,2003,6,22,2,20030622,2003 - T2,T2,1,Dimanche,Di
23/06/2003,2003,6,23,2,20030623,2003 - T2,T2,2,Lundi,Lu
24/06/2003,2003,6,24,2,20030624,2003 - T2,T2,3,Mardi,Ma
25/06/2003,2003,6,25,2,20030625,2003 - T2,T2,4,Mercredi,Me
26/06/2003,2003,6,26,2,20030626,2003 - T2,T2,5,Jeudi,Je
27/06/2003,2003,6,27,2,20030627,2003 - T2,T2,6,Vendredi,Ve
28/06/2003,2003,6,28,2,20030628,2003 - T2,T2,7,Samedi,Sa
29/06/2003,2003,6,29,2,20030629,2003 - T2,T2,1,Dimanche,Di
30/06/2003,2003,6,30,2,20030630,2003 - T2,T2,2,Lundi,Lu
01/07/2003,2003,7,1,3,20030701,2003 - T3,T3,3,Mardi,Ma
02/07/2003,2003,7,2,3,20030702,2003 - T3,T3,4,Mercredi,Me
03/07/2003,2003,7,3,3,20030703,2003 - T3,T3,5,Jeudi,Je
04/07/2003,2003,7,4,3,20030704,2003 - T3,T3,6,Vendredi,Ve
05/07/2003,2003,7,5,3,20030705,2003 - T3,T3,7,Samedi,Sa
06/07/2003,2003,7,6,3,20030706,2003 - T3,T3,1,Dimanche,Di
07/07/2003,2003,7,7,3,20030707,2003 - T3,T3,2,Lundi,Lu
08/07/2003,2003,7,8,3,20030708,2003 - T3,T3,3,Mardi,Ma
09/07/2003,2003,7,9,3,20030709,2003 - T3,T3,4,Mercredi,Me
10/07/2003,2003,7,10,3,20030710,2003 - T3,T3,5,Jeudi,Je
11/07/2003,2003,7,11,3,20030711,2003 - T3,T3,6,Vendredi,Ve
12/07/2003,2003,7,12,3,20030712,2003 - T3,T3,7,Samedi,Sa
13/07/2003,2003,7,13,3,20030713,2003 - T3,T3,1,Dimanche,Di
14/07/2003,2003,7,14,3,20030714,2003 - T3,T3,2,Lundi,Lu
15/07/2003,2003,7,15,3,20030715,2003 - T3,T3,3,Mardi,Ma
16/07/2003,2003,7,16,3,20030716,2003 - T3,T3,4,Mercredi,Me
17/07/2003,2003,7,17,3,20030717,2003 - T3,T3,5,Jeudi,Je
18/07/2003,2003,7,18,3,20030718,2003 - T3,T3,6,Vendredi,Ve
19/07/2003,2003,7,19,3,20030719,2003 - T3,T3,7,Samedi,Sa
20/07/2003,2003,7,20,3,20030720,2003 - T3,T3,1,Dimanche,Di
21/07/2003,2003,7,21,3,20030721,2003 - T3,T3,2,Lundi,Lu
22/07/2003,2003,7,22,3,20030722,2003 - T3,T3,3,Mardi,Ma
23/07/2003,2003,7,23,3,20030723,2003 - T3,T3,4,Mercredi,Me
24/07/2003,2003,7,24,3,20030724,2003 - T3,T3,5,Jeudi,Je
25/07/2003,2003,7,25,3,20030725,2003 - T3,T3,6,Vendredi,Ve
26/07/2003,2003,7,26,3,20030726,2003 - T3,T3,7,Samedi,Sa
27/07/2003,2003,7,27,3,20030727,2003 - T3,T3,1,Dimanche,Di
28/07/2003,2003,7,28,3,20030728,2003 - T3,T3,2,Lundi,Lu
29/07/2003,2003,7,29,3,20030729,2003 - T3,T3,3,Mardi,Ma
30/07/2003,2003,7,30,3,20030730,2003 - T3,T3,4,Mercredi,Me
31/07/2003,2003,7,31,3,20030731,2003 - T3,T3,5,Jeudi,Je
01/08/2003,2003,8,1,3,20030801,2003 - T3,T3,6,Vendredi,Ve
02/08/2003,2003,8,2,3,20030802,2003 - T3,T3,7,Samedi,Sa
03/08/2003,2003,8,3,3,20030803,2003 - T3,T3,1,Dimanche,Di
04/08/2003,2003,8,4,3,20030804,2003 - T3,T3,2,Lundi,Lu
05/08/2003,2003,8,5,3,20030805,2003 - T3,T3,3,Mardi,Ma
06/08/2003,2003,8,6,3,20030806,2003 - T3,T3,4,Mercredi,Me
07/08/2003,2003,8,7,3,20030807,2003 - T3,T3,5,Jeudi,Je
08/08/2003,2003,8,8,3,20030808,2003 - T3,T3,6,Vendredi,Ve
09/08/2003,2003,8,9,3,20030809,2003 - T3,T3,7,Samedi,Sa
10/08/2003,2003,8,10,3,20030810,2003 - T3,T3,1,Dimanche,Di
11/08/2003,2003,8,11,3,20030811,2003 - T3,T3,2,Lundi,Lu
12/08/2003,2003,8,12,3,20030812,2003 - T3,T3,3,Mardi,Ma
13/08/2003,2003,8,13,3,20030813,2003 - T3,T3,4,Mercredi,Me
14/08/2003,2003,8,14,3,20030814,2003 - T3,T3,5,Jeudi,Je
15/08/2003,2003,8,15,3,20030815,2003 - T3,T3,6,Vendredi,Ve
16/08/2003,2003,8,16,3,20030816,2003 - T3,T3,7,Samedi,Sa
17/08/2003,2003,8,17,3,20030817,2003 - T3,T3,1,Dimanche,Di
18/08/2003,2003,8,18,3,20030818,2003 - T3,T3,2,Lundi,Lu
19/08/2003,2003,8,19,3,20030819,2003 - T3,T3,3,Mardi,Ma
20/08/2003,2003,8,20,3,20030820,2003 - T3,T3,4,Mercredi,Me
21/08/2003,2003,8,21,3,20030821,2003 - T3,T3,5,Jeudi,Je
22/08/2003,2003,8,22,3,20030822,2003 - T3,T3,6,Vendredi,Ve
23/08/2003,2003,8,23,3,20030823,2003 - T3,T3,7,Samedi,Sa
24/08/2003,2003,8,24,3,20030824,2003 - T3,T3,1,Dimanche,Di
25/08/2003,2003,8,25,3,20030825,2003 - T3,T3,2,Lundi,Lu
26/08/2003,2003,8,26,3,20030826,2003 - T3,T3,3,Mardi,Ma
27/08/2003,2003,8,27,3,20030827,2003 - T3,T3,4,Mercredi,Me
28/08/2003,2003,8,28,3,20030828,2003 - T3,T3,5,Jeudi,Je
29/08/2003,2003,8,29,3,20030829,2003 - T3,T3,6,Vendredi,Ve
30/08/2003,2003,8,30,3,20030830,2003 - T3,T3,7,Samedi,Sa
31/08/2003,2003,8,31,3,20030831,2003 - T3,T3,1,Dimanche,Di
01/09/2003,2003,9,1,3,20030901,2003 - T3,T3,2,Lundi,Lu
02/09/2003,2003,9,2,3,20030902,2003 - T3,T3,3,Mardi,Ma
03/09/2003,2003,9,3,3,20030903,2003 - T3,T3,4,Mercredi,Me
04/09/2003,2003,9,4,3,20030904,2003 - T3,T3,5,Jeudi,Je
05/09/2003,2003,9,5,3,20030905,2003 - T3,T3,6,Vendredi,Ve
06/09/2003,2003,9,6,3,20030906,2003 - T3,T3,7,Samedi,Sa
07/09/2003,2003,9,7,3,20030907,2003 - T3,T3,1,Dimanche,Di
08/09/2003,2003,9,8,3,20030908,2003 - T3,T3,2,Lundi,Lu
09/09/2003,2003,9,9,3,20030909,2003 - T3,T3,3,Mardi,Ma
10/09/2003,2003,9,10,3,20030910,2003 - T3,T3,4,Mercredi,Me
11/09/2003,2003,9,11,3,20030911,2003 - T3,T3,5,Jeudi,Je
12/09/2003,2003,9,12,3,20030912,2003 - T3,T3,6,Vendredi,Ve
13/09/2003,2003,9,13,3,20030913,2003 - T3,T3,7,Samedi,Sa
14/09/2003,2003,9,14,3,20030914,2003 - T3,T3,1,Dimanche,Di
15/09/2003,2003,9,15,3,20030915,2003 - T3,T3,2,Lundi,Lu
16/09/2003,2003,9,16,3,20030916,2003 - T3,T3,3,Mardi,Ma
17/09/2003,2003,9,17,3,20030917,2003 - T3,T3,4,Mercredi,Me
18/09/2003,2003,9,18,3,20030918,2003 - T3,T3,5,Jeudi,Je
19/09/2003,2003,9,19,3,20030919,2003 - T3,T3,6,Vendredi,Ve
20/09/2003,2003,9,20,3,20030920,2003 - T3,T3,7,Samedi,Sa
21/09/2003,2003,9,21,3,20030921,2003 - T3,T3,1,Dimanche,Di
22/09/2003,2003,9,22,3,20030922,2003 - T3,T3,2,Lundi,Lu
23/09/2003,2003,9,23,3,20030923,2003 - T3,T3,3,Mardi,Ma
24/09/2003,2003,9,24,3,20030924,2003 - T3,T3,4,Mercredi,Me
25/09/2003,2003,9,25,3,20030925,2003 - T3,T3,5,Jeudi,Je
26/09/2003,2003,9,26,3,20030926,2003 - T3,T3,6,Vendredi,Ve
27/09/2003,2003,9,27,3,20030927,2003 - T3,T3,7,Samedi,Sa
28/09/2003,2003,9,28,3,20030928,2003 - T3,T3,1,Dimanche,Di
29/09/2003,2003,9,29,3,20030929,2003 - T3,T3,2,Lundi,Lu
30/09/2003,2003,9,30,3,20030930,2003 - T3,T3,3,Mardi,Ma
01/10/2003,2003,10,1,4,20031001,2003 - T4,T4,4,Mercredi,Me
02/10/2003,2003,10,2,4,20031002,2003 - T4,T4,5,Jeudi,Je
03/10/2003,2003,10,3,4,20031003,2003 - T4,T4,6,Vendredi,Ve
04/10/2003,2003,10,4,4,20031004,2003 - T4,T4,7,Samedi,Sa
05/10/2003,2003,10,5,4,20031005,2003 - T4,T4,1,Dimanche,Di
06/10/2003,2003,10,6,4,20031006,2003 - T4,T4,2,Lundi,Lu
07/10/2003,2003,10,7,4,20031007,2003 - T4,T4,3,Mardi,Ma
08/10/2003,2003,10,8,4,20031008,2003 - T4,T4,4,Mercredi,Me
09/10/2003,2003,10,9,4,20031009,2003 - T4,T4,5,Jeudi,Je
10/10/2003,2003,10,10,4,20031010,2003 - T4,T4,6,Vendredi,Ve
11/10/2003,2003,10,11,4,20031011,2003 - T4,T4,7,Samedi,Sa
12/10/2003,2003,10,12,4,20031012,2003 - T4,T4,1,Dimanche,Di
13/10/2003,2003,10,13,4,20031013,2003 - T4,T4,2,Lundi,Lu
14/10/2003,2003,10,14,4,20031014,2003 - T4,T4,3,Mardi,Ma
15/10/2003,2003,10,15,4,20031015,2003 - T4,T4,4,Mercredi,Me
16/10/2003,2003,10,16,4,20031016,2003 - T4,T4,5,Jeudi,Je
17/10/2003,2003,10,17,4,20031017,2003 - T4,T4,6,Vendredi,Ve
18/10/2003,2003,10,18,4,20031018,2003 - T4,T4,7,Samedi,Sa
19/10/2003,2003,10,19,4,20031019,2003 - T4,T4,1,Dimanche,Di
20/10/2003,2003,10,20,4,20031020,2003 - T4,T4,2,Lundi,Lu
21/10/2003,2003,10,21,4,20031021,2003 - T4,T4,3,Mardi,Ma
22/10/2003,2003,10,22,4,20031022,2003 - T4,T4,4,Mercredi,Me
23/10/2003,2003,10,23,4,20031023,2003 - T4,T4,5,Jeudi,Je
24/10/2003,2003,10,24,4,20031024,2003 - T4,T4,6,Vendredi,Ve
25/10/2003,2003,10,25,4,20031025,2003 - T4,T4,7,Samedi,Sa
26/10/2003,2003,10,26,4,20031026,2003 - T4,T4,1,Dimanche,Di
27/10/2003,2003,10,27,4,20031027,2003 - T4,T4,2,Lundi,Lu
28/10/2003,2003,10,28,4,20031028,2003 - T4,T4,3,Mardi,Ma
29/10/2003,2003,10,29,4,20031029,2003 - T4,T4,4,Mercredi,Me
30/10/2003,2003,10,30,4,20031030,2003 - T4,T4,5,Jeudi,Je
31/10/2003,2003,10,31,4,20031031,2003 - T4,T4,6,Vendredi,Ve
01/11/2003,2003,11,1,4,20031101,2003 - T4,T4,7,Samedi,Sa
02/11/2003,2003,11,2,4,20031102,2003 - T4,T4,1,Dimanche,Di
03/11/2003,2003,11,3,4,20031103,2003 - T4,T4,2,Lundi,Lu
04/11/2003,2003,11,4,4,20031104,2003 - T4,T4,3,Mardi,Ma
05/11/2003,2003,11,5,4,20031105,2003 - T4,T4,4,Mercredi,Me
06/11/2003,2003,11,6,4,20031106,2003 - T4,T4,5,Jeudi,Je
07/11/2003,2003,11,7,4,20031107,2003 - T4,T4,6,Vendredi,Ve
08/11/2003,2003,11,8,4,20031108,2003 - T4,T4,7,Samedi,Sa
09/11/2003,2003,11,9,4,20031109,2003 - T4,T4,1,Dimanche,Di
10/11/2003,2003,11,10,4,20031110,2003 - T4,T4,2,Lundi,Lu
11/11/2003,2003,11,11,4,20031111,2003 - T4,T4,3,Mardi,Ma
12/11/2003,2003,11,12,4,20031112,2003 - T4,T4,4,Mercredi,Me
13/11/2003,2003,11,13,4,20031113,2003 - T4,T4,5,Jeudi,Je
14/11/2003,2003,11,14,4,20031114,2003 - T4,T4,6,Vendredi,Ve
15/11/2003,2003,11,15,4,20031115,2003 - T4,T4,7,Samedi,Sa
16/11/2003,2003,11,16,4,20031116,2003 - T4,T4,1,Dimanche,Di
17/11/2003,2003,11,17,4,20031117,2003 - T4,T4,2,Lundi,Lu
18/11/2003,2003,11,18,4,20031118,2003 - T4,T4,3,Mardi,Ma
19/11/2003,2003,11,19,4,20031119,2003 - T4,T4,4,Mercredi,Me
20/11/2003,2003,11,20,4,20031120,2003 - T4,T4,5,Jeudi,Je
21/11/2003,2003,11,21,4,20031121,2003 - T4,T4,6,Vendredi,Ve
22/11/2003,2003,11,22,4,20031122,2003 - T4,T4,7,Samedi,Sa
23/11/2003,2003,11,23,4,20031123,2003 - T4,T4,1,Dimanche,Di
24/11/2003,2003,11,24,4,20031124,2003 - T4,T4,2,Lundi,Lu
25/11/2003,2003,11,25,4,20031125,2003 - T4,T4,3,Mardi,Ma
26/11/2003,2003,11,26,4,20031126,2003 - T4,T4,4,Mercredi,Me
27/11/2003,2003,11,27,4,20031127,2003 - T4,T4,5,Jeudi,Je
28/11/2003,2003,11,28,4,20031128,2003 - T4,T4,6,Vendredi,Ve
29/11/2003,2003,11,29,4,20031129,2003 - T4,T4,7,Samedi,Sa
30/11/2003,2003,11,30,4,20031130,2003 - T4,T4,1,Dimanche,Di
01/12/2003,2003,12,1,4,20031201,2003 - T4,T4,2,Lundi,Lu
02/12/2003,2003,12,2,4,20031202,2003 - T4,T4,3,Mardi,Ma
03/12/2003,2003,12,3,4,20031203,2003 - T4,T4,4,Mercredi,Me
04/12/2003,2003,12,4,4,20031204,2003 - T4,T4,5,Jeudi,Je
05/12/2003,2003,12,5,4,20031205,2003 - T4,T4,6,Vendredi,Ve
06/12/2003,2003,12,6,4,20031206,2003 - T4,T4,7,Samedi,Sa
07/12/2003,2003,12,7,4,20031207,2003 - T4,T4,1,Dimanche,Di
08/12/2003,2003,12,8,4,20031208,2003 - T4,T4,2,Lundi,Lu
09/12/2003,2003,12,9,4,20031209,2003 - T4,T4,3,Mardi,Ma
10/12/2003,2003,12,10,4,20031210,2003 - T4,T4,4,Mercredi,Me
11/12/2003,2003,12,11,4,20031211,2003 - T4,T4,5,Jeudi,Je
12/12/2003,2003,12,12,4,20031212,2003 - T4,T4,6,Vendredi,Ve
13/12/2003,2003,12,13,4,20031213,2003 - T4,T4,7,Samedi,Sa
14/12/2003,2003,12,14,4,20031214,2003 - T4,T4,1,Dimanche,Di
15/12/2003,2003,12,15,4,20031215,2003 - T4,T4,2,Lundi,Lu
16/12/2003,2003,12,16,4,20031216,2003 - T4,T4,3,Mardi,Ma
17/12/2003,2003,12,17,4,20031217,2003 - T4,T4,4,Mercredi,Me
18/12/2003,2003,12,18,4,20031218,2003 - T4,T4,5,Jeudi,Je
19/12/2003,2003,12,19,4,20031219,2003 - T4,T4,6,Vendredi,Ve
20/12/2003,2003,12,20,4,20031220,2003 - T4,T4,7,Samedi,Sa
21/12/2003,2003,12,21,4,20031221,2003 - T4,T4,1,Dimanche,Di
22/12/2003,2003,12,22,4,20031222,2003 - T4,T4,2,Lundi,Lu
23/12/2003,2003,12,23,4,20031223,2003 - T4,T4,3,Mardi,Ma
24/12/2003,2003,12,24,4,20031224,2003 - T4,T4,4,Mercredi,Me
25/12/2003,2003,12,25,4,20031225,2003 - T4,T4,5,Jeudi,Je
26/12/2003,2003,12,26,4,20031226,2003 - T4,T4,6,Vendredi,Ve
27/12/2003,2003,12,27,4,20031227,2003 - T4,T4,7,Samedi,Sa
28/12/2003,2003,12,28,4,20031228,2003 - T4,T4,1,Dimanche,Di
29/12/2003,2003,12,29,4,20031229,2003 - T4,T4,2,Lundi,Lu
30/12/2003,2003,12,30,4,20031230,2003 - T4,T4,3,Mardi,Ma
31/12/2003,2003,12,31,4,20031231,2003 - T4,T4,4,Mercredi,Me
01/01/2004,2004,1,1,1,20040101,2004 - T1,T1,5,Jeudi,Je
02/01/2004,2004,1,2,1,20040102,2004 - T1,T1,6,Vendredi,Ve
03/01/2004,2004,1,3,1,20040103,2004 - T1,T1,7,Samedi,Sa
04/01/2004,2004,1,4,1,20040104,2004 - T1,T1,1,Dimanche,Di
05/01/2004,2004,1,5,1,20040105,2004 - T1,T1,2,Lundi,Lu
06/01/2004,2004,1,6,1,20040106,2004 - T1,T1,3,Mardi,Ma
07/01/2004,2004,1,7,1,20040107,2004 - T1,T1,4,Mercredi,Me
08/01/2004,2004,1,8,1,20040108,2004 - T1,T1,5,Jeudi,Je
09/01/2004,2004,1,9,1,20040109,2004 - T1,T1,6,Vendredi,Ve
10/01/2004,2004,1,10,1,20040110,2004 - T1,T1,7,Samedi,Sa
11/01/2004,2004,1,11,1,20040111,2004 - T1,T1,1,Dimanche,Di
12/01/2004,2004,1,12,1,20040112,2004 - T1,T1,2,Lundi,Lu
13/01/2004,2004,1,13,1,20040113,2004 - T1,T1,3,Mardi,Ma
14/01/2004,2004,1,14,1,20040114,2004 - T1,T1,4,Mercredi,Me
15/01/2004,2004,1,15,1,20040115,2004 - T1,T1,5,Jeudi,Je
16/01/2004,2004,1,16,1,20040116,2004 - T1,T1,6,Vendredi,Ve
17/01/2004,2004,1,17,1,20040117,2004 - T1,T1,7,Samedi,Sa
18/01/2004,2004,1,18,1,20040118,2004 - T1,T1,1,Dimanche,Di
19/01/2004,2004,1,19,1,20040119,2004 - T1,T1,2,Lundi,Lu
20/01/2004,2004,1,20,1,20040120,2004 - T1,T1,3,Mardi,Ma
21/01/2004,2004,1,21,1,20040121,2004 - T1,T1,4,Mercredi,Me
22/01/2004,2004,1,22,1,20040122,2004 - T1,T1,5,Jeudi,Je
23/01/2004,2004,1,23,1,20040123,2004 - T1,T1,6,Vendredi,Ve
24/01/2004,2004,1,24,1,20040124,2004 - T1,T1,7,Samedi,Sa
25/01/2004,2004,1,25,1,20040125,2004 - T1,T1,1,Dimanche,Di
26/01/2004,2004,1,26,1,20040126,2004 - T1,T1,2,Lundi,Lu
27/01/2004,2004,1,27,1,20040127,2004 - T1,T1,3,Mardi,Ma
28/01/2004,2004,1,28,1,20040128,2004 - T1,T1,4,Mercredi,Me
29/01/2004,2004,1,29,1,20040129,2004 - T1,T1,5,Jeudi,Je
30/01/2004,2004,1,30,1,20040130,2004 - T1,T1,6,Vendredi,Ve
31/01/2004,2004,1,31,1,20040131,2004 - T1,T1,7,Samedi,Sa
01/02/2004,2004,2,1,1,20040201,2004 - T1,T1,1,Dimanche,Di
02/02/2004,2004,2,2,1,20040202,2004 - T1,T1,2,Lundi,Lu
03/02/2004,2004,2,3,1,20040203,2004 - T1,T1,3,Mardi,Ma
04/02/2004,2004,2,4,1,20040204,2004 - T1,T1,4,Mercredi,Me
05/02/2004,2004,2,5,1,20040205,2004 - T1,T1,5,Jeudi,Je
06/02/2004,2004,2,6,1,20040206,2004 - T1,T1,6,Vendredi,Ve
07/02/2004,2004,2,7,1,20040207,2004 - T1,T1,7,Samedi,Sa
08/02/2004,2004,2,8,1,20040208,2004 - T1,T1,1,Dimanche,Di
09/02/2004,2004,2,9,1,20040209,2004 - T1,T1,2,Lundi,Lu
10/02/2004,2004,2,10,1,20040210,2004 - T1,T1,3,Mardi,Ma
11/02/2004,2004,2,11,1,20040211,2004 - T1,T1,4,Mercredi,Me
12/02/2004,2004,2,12,1,20040212,2004 - T1,T1,5,Jeudi,Je
13/02/2004,2004,2,13,1,20040213,2004 - T1,T1,6,Vendredi,Ve
14/02/2004,2004,2,14,1,20040214,2004 - T1,T1,7,Samedi,Sa
15/02/2004,2004,2,15,1,20040215,2004 - T1,T1,1,Dimanche,Di
16/02/2004,2004,2,16,1,20040216,2004 - T1,T1,2,Lundi,Lu
17/02/2004,2004,2,17,1,20040217,2004 - T1,T1,3,Mardi,Ma
18/02/2004,2004,2,18,1,20040218,2004 - T1,T1,4,Mercredi,Me
19/02/2004,2004,2,19,1,20040219,2004 - T1,T1,5,Jeudi,Je
20/02/2004,2004,2,20,1,20040220,2004 - T1,T1,6,Vendredi,Ve
21/02/2004,2004,2,21,1,20040221,2004 - T1,T1,7,Samedi,Sa
22/02/2004,2004,2,22,1,20040222,2004 - T1,T1,1,Dimanche,Di
23/02/2004,2004,2,23,1,20040223,2004 - T1,T1,2,Lundi,Lu
24/02/2004,2004,2,24,1,20040224,2004 - T1,T1,3,Mardi,Ma
25/02/2004,2004,2,25,1,20040225,2004 - T1,T1,4,Mercredi,Me
26/02/2004,2004,2,26,1,20040226,2004 - T1,T1,5,Jeudi,Je
27/02/2004,2004,2,27,1,20040227,2004 - T1,T1,6,Vendredi,Ve
28/02/2004,2004,2,28,1,20040228,2004 - T1,T1,7,Samedi,Sa
29/02/2004,2004,2,29,1,20040229,2004 - T1,T1,1,Dimanche,Di
01/03/2004,2004,3,1,1,20040301,2004 - T1,T1,2,Lundi,Lu
02/03/2004,2004,3,2,1,20040302,2004 - T1,T1,3,Mardi,Ma
03/03/2004,2004,3,3,1,20040303,2004 - T1,T1,4,Mercredi,Me
04/03/2004,2004,3,4,1,20040304,2004 - T1,T1,5,Jeudi,Je
05/03/2004,2004,3,5,1,20040305,2004 - T1,T1,6,Vendredi,Ve
06/03/2004,2004,3,6,1,20040306,2004 - T1,T1,7,Samedi,Sa
07/03/2004,2004,3,7,1,20040307,2004 - T1,T1,1,Dimanche,Di
08/03/2004,2004,3,8,1,20040308,2004 - T1,T1,2,Lundi,Lu
09/03/2004,2004,3,9,1,20040309,2004 - T1,T1,3,Mardi,Ma
10/03/2004,2004,3,10,1,20040310,2004 - T1,T1,4,Mercredi,Me
11/03/2004,2004,3,11,1,20040311,2004 - T1,T1,5,Jeudi,Je
12/03/2004,2004,3,12,1,20040312,2004 - T1,T1,6,Vendredi,Ve
13/03/2004,2004,3,13,1,20040313,2004 - T1,T1,7,Samedi,Sa
14/03/2004,2004,3,14,1,20040314,2004 - T1,T1,1,Dimanche,Di
15/03/2004,2004,3,15,1,20040315,2004 - T1,T1,2,Lundi,Lu
16/03/2004,2004,3,16,1,20040316,2004 - T1,T1,3,Mardi,Ma
17/03/2004,2004,3,17,1,20040317,2004 - T1,T1,4,Mercredi,Me
18/03/2004,2004,3,18,1,20040318,2004 - T1,T1,5,Jeudi,Je
19/03/2004,2004,3,19,1,20040319,2004 - T1,T1,6,Vendredi,Ve
20/03/2004,2004,3,20,1,20040320,2004 - T1,T1,7,Samedi,Sa
21/03/2004,2004,3,21,1,20040321,2004 - T1,T1,1,Dimanche,Di
22/03/2004,2004,3,22,1,20040322,2004 - T1,T1,2,Lundi,Lu
23/03/2004,2004,3,23,1,20040323,2004 - T1,T1,3,Mardi,Ma
24/03/2004,2004,3,24,1,20040324,2004 - T1,T1,4,Mercredi,Me
25/03/2004,2004,3,25,1,20040325,2004 - T1,T1,5,Jeudi,Je
26/03/2004,2004,3,26,1,20040326,2004 - T1,T1,6,Vendredi,Ve
27/03/2004,2004,3,27,1,20040327,2004 - T1,T1,7,Samedi,Sa
28/03/2004,2004,3,28,1,20040328,2004 - T1,T1,1,Dimanche,Di
29/03/2004,2004,3,29,1,20040329,2004 - T1,T1,2,Lundi,Lu
30/03/2004,2004,3,30,1,20040330,2004 - T1,T1,3,Mardi,Ma
31/03/2004,2004,3,31,1,20040331,2004 - T1,T1,4,Mercredi,Me
01/04/2004,2004,4,1,2,20040401,2004 - T2,T2,5,Jeudi,Je
02/04/2004,2004,4,2,2,20040402,2004 - T2,T2,6,Vendredi,Ve
03/04/2004,2004,4,3,2,20040403,2004 - T2,T2,7,Samedi,Sa
04/04/2004,2004,4,4,2,20040404,2004 - T2,T2,1,Dimanche,Di
05/04/2004,2004,4,5,2,20040405,2004 - T2,T2,2,Lundi,Lu
06/04/2004,2004,4,6,2,20040406,2004 - T2,T2,3,Mardi,Ma
07/04/2004,2004,4,7,2,20040407,2004 - T2,T2,4,Mercredi,Me
08/04/2004,2004,4,8,2,20040408,2004 - T2,T2,5,Jeudi,Je
09/04/2004,2004,4,9,2,20040409,2004 - T2,T2,6,Vendredi,Ve
10/04/2004,2004,4,10,2,20040410,2004 - T2,T2,7,Samedi,Sa
11/04/2004,2004,4,11,2,20040411,2004 - T2,T2,1,Dimanche,Di
12/04/2004,2004,4,12,2,20040412,2004 - T2,T2,2,Lundi,Lu
13/04/2004,2004,4,13,2,20040413,2004 - T2,T2,3,Mardi,Ma
14/04/2004,2004,4,14,2,20040414,2004 - T2,T2,4,Mercredi,Me
15/04/2004,2004,4,15,2,20040415,2004 - T2,T2,5,Jeudi,Je
16/04/2004,2004,4,16,2,20040416,2004 - T2,T2,6,Vendredi,Ve
17/04/2004,2004,4,17,2,20040417,2004 - T2,T2,7,Samedi,Sa
18/04/2004,2004,4,18,2,20040418,2004 - T2,T2,1,Dimanche,Di
19/04/2004,2004,4,19,2,20040419,2004 - T2,T2,2,Lundi,Lu
20/04/2004,2004,4,20,2,20040420,2004 - T2,T2,3,Mardi,Ma
21/04/2004,2004,4,21,2,20040421,2004 - T2,T2,4,Mercredi,Me
22/04/2004,2004,4,22,2,20040422,2004 - T2,T2,5,Jeudi,Je
23/04/2004,2004,4,23,2,20040423,2004 - T2,T2,6,Vendredi,Ve
24/04/2004,2004,4,24,2,20040424,2004 - T2,T2,7,Samedi,Sa
25/04/2004,2004,4,25,2,20040425,2004 - T2,T2,1,Dimanche,Di
26/04/2004,2004,4,26,2,20040426,2004 - T2,T2,2,Lundi,Lu
27/04/2004,2004,4,27,2,20040427,2004 - T2,T2,3,Mardi,Ma
28/04/2004,2004,4,28,2,20040428,2004 - T2,T2,4,Mercredi,Me
29/04/2004,2004,4,29,2,20040429,2004 - T2,T2,5,Jeudi,Je
30/04/2004,2004,4,30,2,20040430,2004 - T2,T2,6,Vendredi,Ve
01/05/2004,2004,5,1,2,20040501,2004 - T2,T2,7,Samedi,Sa
02/05/2004,2004,5,2,2,20040502,2004 - T2,T2,1,Dimanche,Di
03/05/2004,2004,5,3,2,20040503,2004 - T2,T2,2,Lundi,Lu
04/05/2004,2004,5,4,2,20040504,2004 - T2,T2,3,Mardi,Ma
05/05/2004,2004,5,5,2,20040505,2004 - T2,T2,4,Mercredi,Me
06/05/2004,2004,5,6,2,20040506,2004 - T2,T2,5,Jeudi,Je
07/05/2004,2004,5,7,2,20040507,2004 - T2,T2,6,Vendredi,Ve
08/05/2004,2004,5,8,2,20040508,2004 - T2,T2,7,Samedi,Sa
09/05/2004,2004,5,9,2,20040509,2004 - T2,T2,1,Dimanche,Di
10/05/2004,2004,5,10,2,20040510,2004 - T2,T2,2,Lundi,Lu
11/05/2004,2004,5,11,2,20040511,2004 - T2,T2,3,Mardi,Ma
12/05/2004,2004,5,12,2,20040512,2004 - T2,T2,4,Mercredi,Me
13/05/2004,2004,5,13,2,20040513,2004 - T2,T2,5,Jeudi,Je
14/05/2004,2004,5,14,2,20040514,2004 - T2,T2,6,Vendredi,Ve
15/05/2004,2004,5,15,2,20040515,2004 - T2,T2,7,Samedi,Sa
16/05/2004,2004,5,16,2,20040516,2004 - T2,T2,1,Dimanche,Di
17/05/2004,2004,5,17,2,20040517,2004 - T2,T2,2,Lundi,Lu
18/05/2004,2004,5,18,2,20040518,2004 - T2,T2,3,Mardi,Ma
19/05/2004,2004,5,19,2,20040519,2004 - T2,T2,4,Mercredi,Me
20/05/2004,2004,5,20,2,20040520,2004 - T2,T2,5,Jeudi,Je
21/05/2004,2004,5,21,2,20040521,2004 - T2,T2,6,Vendredi,Ve
22/05/2004,2004,5,22,2,20040522,2004 - T2,T2,7,Samedi,Sa
23/05/2004,2004,5,23,2,20040523,2004 - T2,T2,1,Dimanche,Di
24/05/2004,2004,5,24,2,20040524,2004 - T2,T2,2,Lundi,Lu
25/05/2004,2004,5,25,2,20040525,2004 - T2,T2,3,Mardi,Ma
26/05/2004,2004,5,26,2,20040526,2004 - T2,T2,4,Mercredi,Me
27/05/2004,2004,5,27,2,20040527,2004 - T2,T2,5,Jeudi,Je
28/05/2004,2004,5,28,2,20040528,2004 - T2,T2,6,Vendredi,Ve
29/05/2004,2004,5,29,2,20040529,2004 - T2,T2,7,Samedi,Sa
30/05/2004,2004,5,30,2,20040530,2004 - T2,T2,1,Dimanche,Di
31/05/2004,2004,5,31,2,20040531,2004 - T2,T2,2,Lundi,Lu
01/06/2004,2004,6,1,2,20040601,2004 - T2,T2,3,Mardi,Ma
02/06/2004,2004,6,2,2,20040602,2004 - T2,T2,4,Mercredi,Me
03/06/2004,2004,6,3,2,20040603,2004 - T2,T2,5,Jeudi,Je
04/06/2004,2004,6,4,2,20040604,2004 - T2,T2,6,Vendredi,Ve
05/06/2004,2004,6,5,2,20040605,2004 - T2,T2,7,Samedi,Sa
06/06/2004,2004,6,6,2,20040606,2004 - T2,T2,1,Dimanche,Di
07/06/2004,2004,6,7,2,20040607,2004 - T2,T2,2,Lundi,Lu
08/06/2004,2004,6,8,2,20040608,2004 - T2,T2,3,Mardi,Ma
09/06/2004,2004,6,9,2,20040609,2004 - T2,T2,4,Mercredi,Me
10/06/2004,2004,6,10,2,20040610,2004 - T2,T2,5,Jeudi,Je
11/06/2004,2004,6,11,2,20040611,2004 - T2,T2,6,Vendredi,Ve
12/06/2004,2004,6,12,2,20040612,2004 - T2,T2,7,Samedi,Sa
13/06/2004,2004,6,13,2,20040613,2004 - T2,T2,1,Dimanche,Di
14/06/2004,2004,6,14,2,20040614,2004 - T2,T2,2,Lundi,Lu
15/06/2004,2004,6,15,2,20040615,2004 - T2,T2,3,Mardi,Ma
16/06/2004,2004,6,16,2,20040616,2004 - T2,T2,4,Mercredi,Me
17/06/2004,2004,6,17,2,20040617,2004 - T2,T2,5,Jeudi,Je
18/06/2004,2004,6,18,2,20040618,2004 - T2,T2,6,Vendredi,Ve
19/06/2004,2004,6,19,2,20040619,2004 - T2,T2,7,Samedi,Sa
20/06/2004,2004,6,20,2,20040620,2004 - T2,T2,1,Dimanche,Di
21/06/2004,2004,6,21,2,20040621,2004 - T2,T2,2,Lundi,Lu
22/06/2004,2004,6,22,2,20040622,2004 - T2,T2,3,Mardi,Ma
23/06/2004,2004,6,23,2,20040623,2004 - T2,T2,4,Mercredi,Me
24/06/2004,2004,6,24,2,20040624,2004 - T2,T2,5,Jeudi,Je
25/06/2004,2004,6,25,2,20040625,2004 - T2,T2,6,Vendredi,Ve
26/06/2004,2004,6,26,2,20040626,2004 - T2,T2,7,Samedi,Sa
27/06/2004,2004,6,27,2,20040627,2004 - T2,T2,1,Dimanche,Di
28/06/2004,2004,6,28,2,20040628,2004 - T2,T2,2,Lundi,Lu
29/06/2004,2004,6,29,2,20040629,2004 - T2,T2,3,Mardi,Ma
30/06/2004,2004,6,30,2,20040630,2004 - T2,T2,4,Mercredi,Me
01/07/2004,2004,7,1,3,20040701,2004 - T3,T3,5,Jeudi,Je
02/07/2004,2004,7,2,3,20040702,2004 - T3,T3,6,Vendredi,Ve
03/07/2004,2004,7,3,3,20040703,2004 - T3,T3,7,Samedi,Sa
04/07/2004,2004,7,4,3,20040704,2004 - T3,T3,1,Dimanche,Di
05/07/2004,2004,7,5,3,20040705,2004 - T3,T3,2,Lundi,Lu
06/07/2004,2004,7,6,3,20040706,2004 - T3,T3,3,Mardi,Ma
07/07/2004,2004,7,7,3,20040707,2004 - T3,T3,4,Mercredi,Me
08/07/2004,2004,7,8,3,20040708,2004 - T3,T3,5,Jeudi,Je
09/07/2004,2004,7,9,3,20040709,2004 - T3,T3,6,Vendredi,Ve
10/07/2004,2004,7,10,3,20040710,2004 - T3,T3,7,Samedi,Sa
11/07/2004,2004,7,11,3,20040711,2004 - T3,T3,1,Dimanche,Di
12/07/2004,2004,7,12,3,20040712,2004 - T3,T3,2,Lundi,Lu
13/07/2004,2004,7,13,3,20040713,2004 - T3,T3,3,Mardi,Ma
14/07/2004,2004,7,14,3,20040714,2004 - T3,T3,4,Mercredi,Me
15/07/2004,2004,7,15,3,20040715,2004 - T3,T3,5,Jeudi,Je
16/07/2004,2004,7,16,3,20040716,2004 - T3,T3,6,Vendredi,Ve
17/07/2004,2004,7,17,3,20040717,2004 - T3,T3,7,Samedi,Sa
18/07/2004,2004,7,18,3,20040718,2004 - T3,T3,1,Dimanche,Di
19/07/2004,2004,7,19,3,20040719,2004 - T3,T3,2,Lundi,Lu
20/07/2004,2004,7,20,3,20040720,2004 - T3,T3,3,Mardi,Ma
21/07/2004,2004,7,21,3,20040721,2004 - T3,T3,4,Mercredi,Me
22/07/2004,2004,7,22,3,20040722,2004 - T3,T3,5,Jeudi,Je
23/07/2004,2004,7,23,3,20040723,2004 - T3,T3,6,Vendredi,Ve
24/07/2004,2004,7,24,3,20040724,2004 - T3,T3,7,Samedi,Sa
25/07/2004,2004,7,25,3,20040725,2004 - T3,T3,1,Dimanche,Di
26/07/2004,2004,7,26,3,20040726,2004 - T3,T3,2,Lundi,Lu
27/07/2004,2004,7,27,3,20040727,2004 - T3,T3,3,Mardi,Ma
28/07/2004,2004,7,28,3,20040728,2004 - T3,T3,4,Mercredi,Me
29/07/2004,2004,7,29,3,20040729,2004 - T3,T3,5,Jeudi,Je
30/07/2004,2004,7,30,3,20040730,2004 - T3,T3,6,Vendredi,Ve
31/07/2004,2004,7,31,3,20040731,2004 - T3,T3,7,Samedi,Sa
01/08/2004,2004,8,1,3,20040801,2004 - T3,T3,1,Dimanche,Di
02/08/2004,2004,8,2,3,20040802,2004 - T3,T3,2,Lundi,Lu
03/08/2004,2004,8,3,3,20040803,2004 - T3,T3,3,Mardi,Ma
04/08/2004,2004,8,4,3,20040804,2004 - T3,T3,4,Mercredi,Me
05/08/2004,2004,8,5,3,20040805,2004 - T3,T3,5,Jeudi,Je
06/08/2004,2004,8,6,3,20040806,2004 - T3,T3,6,Vendredi,Ve
07/08/2004,2004,8,7,3,20040807,2004 - T3,T3,7,Samedi,Sa
08/08/2004,2004,8,8,3,20040808,2004 - T3,T3,1,Dimanche,Di
09/08/2004,2004,8,9,3,20040809,2004 - T3,T3,2,Lundi,Lu
10/08/2004,2004,8,10,3,20040810,2004 - T3,T3,3,Mardi,Ma
11/08/2004,2004,8,11,3,20040811,2004 - T3,T3,4,Mercredi,Me
12/08/2004,2004,8,12,3,20040812,2004 - T3,T3,5,Jeudi,Je
13/08/2004,2004,8,13,3,20040813,2004 - T3,T3,6,Vendredi,Ve
14/08/2004,2004,8,14,3,20040814,2004 - T3,T3,7,Samedi,Sa
15/08/2004,2004,8,15,3,20040815,2004 - T3,T3,1,Dimanche,Di
16/08/2004,2004,8,16,3,20040816,2004 - T3,T3,2,Lundi,Lu
17/08/2004,2004,8,17,3,20040817,2004 - T3,T3,3,Mardi,Ma
18/08/2004,2004,8,18,3,20040818,2004 - T3,T3,4,Mercredi,Me
19/08/2004,2004,8,19,3,20040819,2004 - T3,T3,5,Jeudi,Je
20/08/2004,2004,8,20,3,20040820,2004 - T3,T3,6,Vendredi,Ve
21/08/2004,2004,8,21,3,20040821,2004 - T3,T3,7,Samedi,Sa
22/08/2004,2004,8,22,3,20040822,2004 - T3,T3,1,Dimanche,Di
23/08/2004,2004,8,23,3,20040823,2004 - T3,T3,2,Lundi,Lu
24/08/2004,2004,8,24,3,20040824,2004 - T3,T3,3,Mardi,Ma
25/08/2004,2004,8,25,3,20040825,2004 - T3,T3,4,Mercredi,Me
26/08/2004,2004,8,26,3,20040826,2004 - T3,T3,5,Jeudi,Je
27/08/2004,2004,8,27,3,20040827,2004 - T3,T3,6,Vendredi,Ve
28/08/2004,2004,8,28,3,20040828,2004 - T3,T3,7,Samedi,Sa
29/08/2004,2004,8,29,3,20040829,2004 - T3,T3,1,Dimanche,Di
30/08/2004,2004,8,30,3,20040830,2004 - T3,T3,2,Lundi,Lu
31/08/2004,2004,8,31,3,20040831,2004 - T3,T3,3,Mardi,Ma
01/09/2004,2004,9,1,3,20040901,2004 - T3,T3,4,Mercredi,Me
02/09/2004,2004,9,2,3,20040902,2004 - T3,T3,5,Jeudi,Je
03/09/2004,2004,9,3,3,20040903,2004 - T3,T3,6,Vendredi,Ve
04/09/2004,2004,9,4,3,20040904,2004 - T3,T3,7,Samedi,Sa
05/09/2004,2004,9,5,3,20040905,2004 - T3,T3,1,Dimanche,Di
06/09/2004,2004,9,6,3,20040906,2004 - T3,T3,2,Lundi,Lu
07/09/2004,2004,9,7,3,20040907,2004 - T3,T3,3,Mardi,Ma
08/09/2004,2004,9,8,3,20040908,2004 - T3,T3,4,Mercredi,Me
09/09/2004,2004,9,9,3,20040909,2004 - T3,T3,5,Jeudi,Je
10/09/2004,2004,9,10,3,20040910,2004 - T3,T3,6,Vendredi,Ve
11/09/2004,2004,9,11,3,20040911,2004 - T3,T3,7,Samedi,Sa
12/09/2004,2004,9,12,3,20040912,2004 - T3,T3,1,Dimanche,Di
13/09/2004,2004,9,13,3,20040913,2004 - T3,T3,2,Lundi,Lu
14/09/2004,2004,9,14,3,20040914,2004 - T3,T3,3,Mardi,Ma
15/09/2004,2004,9,15,3,20040915,2004 - T3,T3,4,Mercredi,Me
16/09/2004,2004,9,16,3,20040916,2004 - T3,T3,5,Jeudi,Je
17/09/2004,2004,9,17,3,20040917,2004 - T3,T3,6,Vendredi,Ve
18/09/2004,2004,9,18,3,20040918,2004 - T3,T3,7,Samedi,Sa
19/09/2004,2004,9,19,3,20040919,2004 - T3,T3,1,Dimanche,Di
20/09/2004,2004,9,20,3,20040920,2004 - T3,T3,2,Lundi,Lu
21/09/2004,2004,9,21,3,20040921,2004 - T3,T3,3,Mardi,Ma
22/09/2004,2004,9,22,3,20040922,2004 - T3,T3,4,Mercredi,Me
23/09/2004,2004,9,23,3,20040923,2004 - T3,T3,5,Jeudi,Je
24/09/2004,2004,9,24,3,20040924,2004 - T3,T3,6,Vendredi,Ve
25/09/2004,2004,9,25,3,20040925,2004 - T3,T3,7,Samedi,Sa
26/09/2004,2004,9,26,3,20040926,2004 - T3,T3,1,Dimanche,Di
27/09/2004,2004,9,27,3,20040927,2004 - T3,T3,2,Lundi,Lu
28/09/2004,2004,9,28,3,20040928,2004 - T3,T3,3,Mardi,Ma
29/09/2004,2004,9,29,3,20040929,2004 - T3,T3,4,Mercredi,Me
30/09/2004,2004,9,30,3,20040930,2004 - T3,T3,5,Jeudi,Je
01/10/2004,2004,10,1,4,20041001,2004 - T4,T4,6,Vendredi,Ve
02/10/2004,2004,10,2,4,20041002,2004 - T4,T4,7,Samedi,Sa
03/10/2004,2004,10,3,4,20041003,2004 - T4,T4,1,Dimanche,Di
04/10/2004,2004,10,4,4,20041004,2004 - T4,T4,2,Lundi,Lu
05/10/2004,2004,10,5,4,20041005,2004 - T4,T4,3,Mardi,Ma
06/10/2004,2004,10,6,4,20041006,2004 - T4,T4,4,Mercredi,Me
